,abstract,citations,link,reference,title,year
200,"… Here the data is stored as fragments in many  and the data can be reconstructed whenit …  issues related to authentication, authorization and accounting … a user, enforcing policies,confirmation on user's identity to connect, to access or use the  resources and … ",10,https://www.degruyter.com/downloadpdf/j/cait.2017.17.issue-4/cait-2017-0039/cait-2017-0039.xml,", , P Jelciana - Cybernetics and Information …, 2017 - degruyter.com","Exploring cloud security ""VM Escape"" attack virtual machine Iaas issues and solutions in cloud security ""VM Escape"" attack virtual machine Iaas computing services–a survey",2017.0
175,"… [24] demonstrate that DDoS  in  affect the … used in  Computing web servicesand very little work has been done to ensure  related to … However, service providers shouldstill take those  into account; otherwise,  elasticity would be used to … ",23,https://www.mdpi.com/1999-5903/9/3/43,"A Bonguet, M Bellaiche - Future Internet, 2017 - mdpi.com","A survey of denial-of-service and distributed denial of service cloud security ""VM Escape"" attack virtual machine Iaas and defenses in cloud security ""VM Escape"" attack virtual machine Iaas computing",2017.0
3,"… However, the  threats by  involving the VMs can lead to financial harm and impacts …In  , DoS and DDoS constitute the most common  and “largest threat”[51] … Anadditional cost to the  provider is the penalties negotiated with users, which are … ",10,https://link.springer.com/article/10.1186/s13677-017-0098-8,", , … - Journal of  …, 2017 - Springer","Classifying malware cloud security ""VM Escape"" attack virtual machine Iaas in cloud security ""VM Escape"" attack virtual machine Iaas environments",2017.0
15,"… In public , the network topology will have to change with the  requirement … But whenrunning critical processes over the  or processing critical data, the VM must be safeguardedagainst all sorts of  that could … This results in a breach of  policies … ",4,https://ieeexplore.ieee.org/abstract/document/8299854/,"M Chandni, NP Sowmiya, S Mohana… - 2017 International …, 2017 - ieeexplore.ieee.org","Establishing trust despite cloud security ""VM Escape"" attack virtual machine Iaas in cloud security ""VM Escape"" attack virtual machine Iaas computing: A survey",2017.0
30,"… [7] P. Chouhan, F. Yao and S. Sezer, ""Software as a service: Understanding  issues”,2015 … Leckie, “Using   Allocation Policies to Defend against Co-resident in  Computing” IEEE Transactions on Dependable and  Computing, pp … ",6,https://ieeexplore.ieee.org/abstract/document/7905282/,"MS Dildar, , … - 2017 2nd International …, 2017 - ieeexplore.ieee.org","Effective way to defend the hypervisor cloud security ""VM Escape"" attack virtual machine Iaas in cloud security ""VM Escape"" attack virtual machine Iaas computing",2017.0
70,… Hardware based mechanism is discussed in Jin et al. [82] to  guest  beneath unreliable hypervisor … This approach decreases the complexity and provides against various physical intrusions in  datacenter. 3.2.5VM scheduling  … ,4,https://content.iospress.com/articles/multiagent-and-grid-systems/mgs262,"DJ Prathyusha, S Naseera - Multiagent and Grid Systems, 2017 - content.iospress.com","A study on cloud security ""VM Escape"" attack virtual machine Iaas issues",2017.0
19,"…  administrators are the gatekeepers of the whole infrastructure and their accounts are thekeys. It should be mandat- ed to  admin accounts by applying a strong password policyalong …  ZONING To prevent a VM from impacting other VMs or hosts, it is a … ",63,https://ieeexplore.ieee.org/abstract/document/7927935/,", ,  - IEEE Communications Magazine, 2017 - ieeexplore.ieee.org","NFV: cloud security ""VM Escape"" attack virtual machine Iaas threats and best practices",2017.0
36,"…  in the attacker's request can't be an effective presence flooded the user's request … 235Analysis of Various  Issues and Challenges in  Computing Environment … to createhis / her malicious services, such as the SaaS, PaaS or  and add them to the  … ",32,https://www.igi-global.com/chapter/analysis-of-various-security-issues-and-challenges-in-cloud-computing-environment/167228,"Z Gou, S Yamaguchi, BB Gupta - Identity Theft: Breakthroughs in …, 2017 - igi-global.com","Analysis of various cloud security ""VM Escape"" attack virtual machine Iaas issues and challenges in cloud security ""VM Escape"" attack virtual machine Iaas computing environment: a survey",2017.0
27,"… Monitor (VMM) or hypervisor which is main component of Virtualized  ComputingInfrastructure … Due to software based vulnerabilities, VMMs are compromised to  that may take … In order to formulate a  VCCI, VMM must be protected by implementing … ",2,https://www.scirp.org/html/1-7800414_72584.htm,"AFS Althobaiti - Journal of Information , 2017 - scirp.org","Analyzing cloud security ""VM Escape"" attack virtual machine Iaas threats to cloud security ""VM Escape"" attack virtual machine Iaas monitor in cloud security ""VM Escape"" attack virtual machine Iaas computing environment",2017.0
48,"…  providers have to de- crypt the data to get the actual data in order to process it, whichraises the privacy concerns in the . Many encryption methods are based on the applicationof fully homomorphic encryption to provide in the  of  … ",8,https://www.igi-global.com/chapter/cloud-security-issues-and-challenges/171349,",  - Resource Management and Efficiency in  …, 2017 - igi-global.com",issues and challenges,2017.0
63,"… [7] W. Qiang, K. Zhang, W. Dai, and H. Jin,  cryptographic functions via … and L. Tamilselvan,Dynamic resource monitoring of SaaS with attestation for a trusted  environment, International …[19] V. Varadharajan and U. Tupakula, Counteracting   in  … ",5,https://ieeexplore.ieee.org/abstract/document/8030536/,"X Jin, X Chen, C Zhao, D Zhao - Tsinghua Science and …, 2017 - ieeexplore.ieee.org",Trusted attestation architecture on an infrastructure-as-a-service,2017.0
55,"… E., Shacham, H., Savage, S.: Exploring information leakage in third-party compute . In:Proceeding of 16th ACM Conference on Computer and Communications , pp … 5. Shei,S., Kalloniatis, C., Mouratidis, H., Delaney, A.: Modelling   computing systems … ",3,https://link.springer.com/chapter/10.1007/978-3-319-59466-8_21,", ,  - Enterprise, Business-Process and …, 2017 - Springer","A cloud security ""VM Escape"" attack virtual machine Iaas requirements modelling language to cloud security ""VM Escape"" attack virtual machine Iaas computing environments",2017.0
345,"… Public  eg Google  is using AES to encrypt data in storage [13 … However, suchinformation utilization requires appropriate  technologies to collect, store, analyze andvisualize … CONCLUSION The work on  and optimization of data in  storage through … ",9,https://ieeexplore.ieee.org/abstract/document/8288912/,", AR Shovon… - 2017 IEEE Region 10 …, 2017 - ieeexplore.ieee.org","Combined approach of tokenization and mining to cloud security ""VM Escape"" attack virtual machine Iaas and optimize big data in cloud security ""VM Escape"" attack virtual machine Iaas storage",2017.0
206,"… R. Griffith, AD Joseph, R. Katz, A. Konwinski, G. Lee, D. Patterson, A. Rabkin, I. Stoica, and M.Zaharia, “Clearing the  away from … [14] M. Ali, SU Khan, and AV Vasilakos, “ in computing: Opportunities … [15] M. Jouini and LBA Rabai, “A  Framework for … ",17,https://ieeexplore.ieee.org/abstract/document/7905258/," - 2017 2nd International Conference on Anti-Cyber …, 2017 - ieeexplore.ieee.org","computing: Technology, cloud security ""VM Escape"" attack virtual machine Iaas issues and solutions",2017.0
101,"… We will review in network layer all methods, approaches and  tools used to the public net- work.  Computing represents all  threats in 307 Page 6. (a) in depth (b) Defense in depth Fig. 2:  and defense in depth … ",5,https://ieeexplore.ieee.org/abstract/document/8308301/,"M Bouchaala, , LA Saidane… - 2017 IEEE/ACS 14th …, 2017 - ieeexplore.ieee.org","End to end cloud security ""VM Escape"" attack virtual machine Iaas computing architecture based on a novel classification of cloud security ""VM Escape"" attack virtual machine Iaas issues",2017.0
259,"… Hybrid  goal is to utilize the advantages of the public and private  … need to follow up standards such as ISO 27001 information  management system … detection system(NIDS) on the internal network, using segmentation methods in  network and … ",2,http://www.diva-portal.org/smash/record.jsf?pid=diva2:1117240, - 2017 - diva-portal.org,"An Investigation of the Impact of the Slow HTTP DOS and DDOS cloud security ""VM Escape"" attack virtual machine Iaas on the cloud security ""VM Escape"" attack virtual machine Iaas environment",2017.0
295,"… 3) Services Isolation Isolating services without sharing kernel is absolute requirement on public … service isolation and it should be the preferred mechanism for   computing …is as important to organizations as reliability, performance, and  when deciding … ",1,https://ieeexplore.ieee.org/abstract/document/8101597/,"AH Al-Sharidah, HA Al-Essa - 2017 9th Computer Science and …, 2017 - ieeexplore.ieee.org","Toward cost effective and optimal selection of IT disaster recovery cloud security ""VM Escape"" attack virtual machine Iaas solution",2017.0
322,… 140 141 Virtualization; Hypervisor;  ;  Network;  Configuration; 142 Monitoring; Guest …  RECOMMENDATIONS FOR HYPERVISORDEPLOYMENT iv … used as enterprise IT 187 infrastructure and in those offered for  service … ,HTML-versie,https://csrc.nist.gov/publications/detail/sp/800-125a/archive/2017-09-14, - 2017 - csrc.nist.gov,Recommendations for Hypervisor Deployment (2nd Draft),2017.0
198,"… Then, he/she can move from one VM to another, if the  framework is compromised … 18The VENOM   (CVE-2015-3456) 19 flow is a recently identified in Quick Emulator's …attacker can be  users or other external users who access the  resources and … ",34,https://link.springer.com/article/10.1007/s11227-016-1805-9,", K Acha - the Journal of Supercomputing, 2017 - Springer","Virtualization layer cloud security ""VM Escape"" attack virtual machine Iaas challenges and intrusion detection/prevention systems in cloud security ""VM Escape"" attack virtual machine Iaas computing: a comprehensive review",2017.0
272,"… so we need to combine both cryptographic primitives to achieve these  principles … proposed data sharing in  (SeDaSC) [60] methodology applicable in both conventional and …data owner, trusted third party known as cryptographic server on  (CS) and … ",17,https://link.springer.com/article/10.1007/s11227-016-1945-y,", AK Verma - The Journal of Supercomputing, 2017 - Springer","Data cloud security ""VM Escape"" attack virtual machine Iaas in mobile cloud security ""VM Escape"" attack virtual machine Iaas computing paradigm: a survey, taxonomy and open research issues",2017.0
383,"… applications. There are several solutions proposed to  the data for both data … batchcomputing model is not suitable.  computing has become a platform of … era, whereasthe data stream  has received little attention from researchers … ",1,https://opus.lib.uts.edu.au/handle/10453/102735, - 2017 - opus.lib.uts.edu.au,"Towards efficient and lightweight cloud security ""VM Escape"" attack virtual machine Iaas architecture for big sensing data streams",2017.0
93,"… A  that is deployed and shared among a group of people for share common interest, suchas mission,  policy, application and services is known as community  … A hybrid is mixing of two or more  with same infrastructure and capabilities. 3.4 … ",150,https://www.sciencedirect.com/science/article/pii/S1084804516302983,",  - Journal of Network and Computer Applications, 2017 - Elsevier",issues and challenges: A survey,2017.0
382,"… out afterwards, elaborating on a novel applicability of these systems to  computingenvironments … For example, one can consider deployment, purpose or scope of  solutionsfor such … Whereas the detection of malicious processes is done at the  level, detection of … ",16,https://www.sciencedirect.com/science/article/pii/S221421261630240X,", , … - … of Information  …, 2017 - Elsevier","Applications of artificial immune systems to computer cloud security ""VM Escape"" attack virtual machine Iaas : A survey",2017.0
271,… A Quantitative Methodology for   Risk Assessment 97 … EDoS (Economic Denial ofSustainability) is specific to  environment which results in exploitation of financial … 5) : This is caused by exploitation of the hypervisor (code) resulting in the transfer of … ,1,https://www.researchgate.net/profile/Srijita_Basu/publication/317299390_A_Quantitative_Methodology_for_Cloud_Security_Risk_Assessment/links/5d313bbb92851cf440901d98/A-Quantitative-Methodology-for-Cloud-Security-Risk-Assessment.pdf,", A Sengupta, C Mazumdar - CLOSER, 2017 - researchgate.net","A Quantitative Methodology for cloud security ""VM Escape"" attack virtual machine Iaas Risk Assessment.",2017.0
377,"… ting, ie the abstract and the contents included mention of risks, threats,  or vul … Theadvent of  computing in its current form could be attributed to the further … configured operating system image is available, the   can be … ",1,https://www.utupub.fi/bitstream/handle/10024/130542/TSEgradu2016Nurmilahti.pdf?sequence=2,A Nurmilahti - 2017 - utupub.fi,"Risks in cloud security ""VM Escape"" attack virtual machine Iaas computing",2017.0
179,"… it and that the widespread use of side channel in the  makes the … restrictions are determinedthat accurately define the required information and  mechanisms based … -basedtechnologies, the  on   and hypervisors of  platforms have … ",6,https://link.springer.com/article/10.1007/s11227-017-2025-7,", Y Shams - The Journal of Supercomputing, 2017 - Springer","A game theoretic-based distributed detection method for VM-to-hypervisor cloud security ""VM Escape"" attack virtual machine Iaas in cloud security ""VM Escape"" attack virtual machine Iaas environment",2017.0
370,… 297 Development life-cycle models 297  DevOps 300 Version control and changemanagement 302 Provisioning and deprovisioning 303  coding techniques 303 Codequality and testing 306 …  VDI/VDE  access  broker  as a … ,15,https://books.google.nl/books?hl=nl&lr=&id=NaJBDwAAQBAJ&oi=fnd&pg=PP1&dq=cloud+security+%22VM+Escape%22+attack+virtual+machine+Iaas&ots=dLzamQVdT3&sig=l12Xv3-0rhfu6boWnLAt-Fay2S8,JM Stewart - 2017 - books.google.com,CompTIA Security+ Review Guide: Exam SY0-501,2017.0
170,"… A Survey on  Aspects of Server Virtualization in  Computing (O Sri Nagesh) …According to Gartner [60], ""through 2009, 60 percent of production VMs will be less  thantheir physical … 5. ANALYZE OF  VULNERABILITIES IN VIRTUALIZATION 5.1 … ",7,https://pdfs.semanticscholar.org/491b/fe1eadcb73f31dde3f0b1c482db5d2a3b608.pdf,", … - International Journal of …, 2017 - pdfs.semanticscholar.org","A Survey on cloud security ""VM Escape"" attack virtual machine Iaas Aspects of Server Virtualization in cloud security ""VM Escape"" attack virtual machine Iaas Computing.",2017.0
364,…  and the   Access  Brokers  Storage  as … User IssuesZero-Day Exploits Other Issues Embedded Systems  Application Vulnerabilities InputVulnerabilities Memory Vulnerabilities  Programming Programming … ,41,https://books.google.nl/books?hl=nl&lr=&id=MLg4DwAAQBAJ&oi=fnd&pg=PP1&dq=cloud+security+%22VM+Escape%22+attack+virtual+machine+Iaas&ots=mfdQIYQPJc&sig=KhmFPbTX7h6dfg4LkjmUTyANof4,"E Dulaney,  - 2017 - books.google.com",CompTIA Security+ Study Guide: Exam SY0-501,2017.0
185,"… However, in the case of public or community , administrative control is delegated … makesthe protocols (especially node migration protocol) complicated without additional functionality … The  nodes are treated as trusted only after being authenticated and being … ",1,https://go.gale.com/ps/i.do?id=GALE%7CA500134119&sid=googleScholar&v=2.1&it=r&linkaccess=abs&issn=15827445&p=AONE&sw=w,"H Kim - Advances in Electrical and Computer Engineering, 2017 - go.gale.com","Enhancing trusted cloud security ""VM Escape"" attack virtual machine Iaas computing platform for infrastructure as a service",2017.0
187,"…  user's data or application portability and inter communication across multiple  [64,65] … Network  Enterprises store sensitive data in the  server and SaaS vendor can …network, for example  Socket Layer (SSL) and Transport Layer  (TLS) … ",Alle 2 versiesHTML-versie,http://ir.inflibnet.ac.in:8080/jspui/bitstream/10603/249004/7/ch%202.pdf, - 2017 - ir.inflibnet.ac.in,"Developing A Framework For Strengthening cloud security ""VM Escape"" attack virtual machine Iaas Resource Availability In cloud security ""VM Escape"" attack virtual machine Iaas Environment",2017.0
296,… Our  approach exhibits the following qualities:  Positioning: It is difficult to subvertfrom a … 3.1 Overview of VAED with deployment scenario in . The VAED is a  approachmainly designed to detect the advanced evasive malware by performing out‐VM … ,6,https://onlinelibrary.wiley.com/doi/abs/10.1002/cpe.4133,"P Mishra, , … - Concurrency and …, 2017 - Wiley Online Library",VAED: VMI‐assisted evasion detection approach for infrastructure as a service ,2017.0
192,"… Moreover, VMM is more  than a VM, making the  tools high resistant to compared to … In Network-Monitor based approach,  tools such as IDS and firewall aredeployed at Network points such as entry point in the  network (attached … ",86,https://www.sciencedirect.com/science/article/pii/S1084804516302417,"P Mishra, , … - Journal of Network and …, 2017 - Elsevier","Intrusion detection techniques in cloud security ""VM Escape"" attack virtual machine Iaas environment: A survey",2017.0
112,"… pp. 135- 137, IEEE , 2010. xix. Amol Jadhao, Kunal Anand, Shashank Dhar, SagarMukharia:  Trust - a  Assessment Model for Infrastructure as a Service() , IJST, Vol 4, Sep – Oct 2016 xx. Ryan … ",5,http://www.indianjournals.com/ijor.aspx?target=ijor:ijset1&volume=6&issue=1&article=010,",  - International Journal of Scientific …, 2017 - indianjournals.com","Information cloud security ""VM Escape"" attack virtual machine Iaas in cloud security ""VM Escape"" attack virtual machine Iaas computing: A Systematic Literature Review and analysis",2017.0
261,… for this collection element is: • it must replicate the virtualised environments found within providers who … At this stage it was decided to build a bespoke  stack … Section II highlightsthe protocol transport features and  mechanisms built into the IPFIX standard in … ,3,http://arro.anglia.ac.uk/id/eprint/703881,"M Graham, A Winckles, E Sanchez - The Journal on Cybercrime …, 2016 - arro.anglia.ac.uk",Practical Experiences of Building an IPFIX Based Open Source Botnet Detector,2016.0
89,"…  problems of platform‐as‐a‐service (PaaS)  and practical solutions to the problems24, PaaS, Discussed the … This modification, whether intentional or not, affects the quality andbehavior of  services; hence, this process should be … 2.2 Data access  … ",11,https://onlinelibrary.wiley.com/doi/abs/10.1002/sec.1585,", , … - and …, 2016 - Wiley Online Library","Service delivery models of cloud security ""VM Escape"" attack virtual machine Iaas computing: cloud security ""VM Escape"" attack virtual machine Iaas issues and open challenges",2016.0
230,"… VMs and their associated VM based defenses with no disruption in , enabling moving …A hypervisor can be utilized in Infrastructure as a Service ()  systems, for instance … orVM based defenses cannot be compromised by Layer 2    or  on … ",26,https://patents.google.com/patent/US9342343B2/en," - US Patent 9,342,343, 2016 - Google Patents",Wrapped nested virtualization,2016.0
42,"… [13] Somorovsky, Juraj, Mario Heiderich, Meiko Jensen, Jörg Schwenk, Nils Gruschka, and LuigiLo Iacono. ""All your  are belonging to us:  analysis of  management interfaces.""3rd ACM workshop on  computing  workshop, pp. 3-14 … ",3,https://dl.acm.org/doi/abs/10.1145/2905055.2905315,", ,  - Proceedings of the Second …, 2016 - dl.acm.org","challenges of virtualization in cloud security ""VM Escape"" attack virtual machine Iaas computing",2016.0
240,… sub- categories where a TTP has been used to provide cryptographic services to  users …management system being executed as a multiparty protocol among user VMs running onuntrusted . This approach is already a part of some -as-a-service commer- cial … ,6,https://ieeexplore.ieee.org/abstract/document/7571091/,"B AlBelooshi, , … - IEEE  …, 2016 - ieeexplore.ieee.org","Securing cryptographic keys in the cloud security ""VM Escape"" attack virtual machine Iaas : A survey",2016.0
2,"… Hybrid  – Hybrid  comprises of the combination of minimum two , can be … MAJOR ISSUES IN : VIRTUALIZATION • VM image sharing: A VM image is used to …VM image will become source of injecting malware in the  computing system … ",13,https://ieeexplore.ieee.org/abstract/document/7570872/,"G Nenvani,  - 2016 Symposium on Colossal Data …, 2016 - ieeexplore.ieee.org","A survey on cloud security ""VM Escape"" attack virtual machine Iaas detection on cloud security ""VM Escape"" attack virtual machine Iaas using supervised learning techniques",2016.0
13,"… reliable, highly-available, and scalable software and hardware infrastructures referred to as  …Normally a  user cannot know on which hypervisor his/her … vulnerability allows remote and malware to compromise the overall   , also granting … ",6,https://ieeexplore.ieee.org/abstract/document/7756210/,", , … - 2016 IEEE 36th …, 2016 - ieeexplore.ieee.org","Intrusion detection and cloud security ""VM Escape"" attack virtual machine Iaas tolerance for cloud security ""VM Escape"" attack virtual machine Iaas environments: the CLARUS approach",2016.0
18,"… And some  measures are proposed for  in case of VM creation, VM migration andto solve VM isolation problem and   … [3] M. Armbrust, AD Joseph, RH Katz and DAPatterson, “Above the : A Berkeley View of  Computing,” University … ",1,https://pdfs.semanticscholar.org/bd48/23914d7887b413be7c8566a7ec732efe1e63.pdf,"S Jadon, … - International Journal of …, 2016 - pdfs.semanticscholar.org","A Survey on Infrastructure as Service Layer based cloud security ""VM Escape"" attack virtual machine Iaas Models for ",2016.0
92,"… These loopholes in TCP/IP are equally cause vulnerability to  typically for Public .Figure 1.  Architecture … Use of Cryptography in  Computing."" International … SubVirt:Implementing malware with  ."" IEEE Symposium on  and Privacy … ",9,https://pdfs.semanticscholar.org/2887/874a69f870c585ca082ef17d48fd84716680.pdf," - Journal of Wireless Communications, 2016 - pdfs.semanticscholar.org","computing: cloud security ""VM Escape"" attack virtual machine Iaas issues and challenges",2016.0
301,"… If the  does not satisfy  disposal mechanisms, then this may lead to sensitive …Infrastructure-as-a-Service  provide   to clients to run their software on …Trusted Computing (TC) is a  mechanism for  where execution of a   … ",20,https://link.springer.com/article/10.1007/s12652-016-0385-0," - Journal of Ambient Intelligence and Humanized …, 2016 - Springer","A comprehensive meta-analysis of cryptographic cloud security ""VM Escape"" attack virtual machine Iaas mechanisms for cloud security ""VM Escape"" attack virtual machine Iaas computing",2016.0
21,"… in the ,"" presented at the Eighth IEEE International Conference on Dependable, AutonomIcand  Computing, Chengdu … [11] Jinpeng Wei, Xiaolan Zhang, Glenn Ammons et.al.,“Managing  of   Images in a  Environment”, ACM … ",3,https://www.researchgate.net/profile/Amit_Wadhwa2/publication/304570398_Comprehensive_Analysis_of_Security_Issues_and_Solutions_While_Migrating_to_Cloud_Environment/links/577391df08ae4645d609cbb0.pdf," - International Journal of New Innovations in …, 2016 - researchgate.net","Comprehensive Analysis of cloud security ""VM Escape"" attack virtual machine Iaas Issues and Solutions While Migrating to cloud security ""VM Escape"" attack virtual machine Iaas Environment",2016.0
68,"… p. 199–212. 13. Aviram A, Hu S, Ford B, Gummadi R. Determinating timing channelsin compute , In Proceeding of ACM workshop on  computing workshop ACM, New York, NY, USA; 2010. p. 103–8. 14 … ",5,https://pdfs.semanticscholar.org/904b/9c907ed8b2755252afe354562ae19c47e30a.pdf,"K Padmaja, R Seshadri - Indian Journal of Science and …, 2016 - pdfs.semanticscholar.org","A review on cloud security ""VM Escape"" attack virtual machine Iaas computing technologies and cloud security ""VM Escape"" attack virtual machine Iaas issues",2016.0
20,"… ""-Trust-a  Assessment Model for Infrastructure as a Service () ."" [11]Payne, Bryan D., Martim Carbone, Monirul Sharif, and Wenke Lee. ""Lares: An architecture for active monitoring using virtualization."" In  and Privacy, 2008. SP 2008 … ",1,https://ieeexplore.ieee.org/abstract/document/7942605/,"SM Deshpande, B Ainapure - 2016 IEEE International …, 2016 - ieeexplore.ieee.org","An Intelligent cloud security ""VM Escape"" attack virtual machine Iaas Monitoring System Using KVM for Reliable And cloud security ""VM Escape"" attack virtual machine Iaas Environment in ",2016.0
