,abstract,citations,link,reference,title,year
116,"… 3. Traffic between remote  sites: Reducing traffic in the federated  … Additionally,with the ever increasing   on the VMs and the  services, providing in the  environment has become a more critical issue … ",13,https://pdfs.semanticscholar.org/c596/fdae98ad133218364fd083094a634846ffc3.pdf,", , Y Golechha… - International Journal of …, 2016 - pdfs.semanticscholar.org","A comparative analysis of cloud security ""VM Escape"" attack virtual machine Iaas placement techniques in the cloud security ""VM Escape"" attack virtual machine Iaas environment",2016.0
106,"… [11] T. Ristenpart, E. Tromer, H. Shacham, and S. Savage, \Hey, you, get o_ of my :exploring information leakage in third-party compute ,"" in In CCS09: Proceedings ofthe 16th ACM conference on Computer and communications , pp … ",2,https://www.ijcrcst.com/papers/IJCRCST-JANUARY16-06.pdf,"P Kaladevi,  - database, 2016 - ijcrcst.com","A study on intrusion detection systems in cloud security ""VM Escape"" attack virtual machine Iaas computing",2016.0
144,"… storage. In [55], Bessani et al. proposed Depsky which uses many  to builda -of- to address two  requirements in their storage system,which are confidentiality and availability of data. They … ",82,https://pdfs.semanticscholar.org/09fd/5326be429b39d75103ddd6550176c10e0ba3.pdf,"S Aldossary,  - International Journal of …, 2016 - pdfs.semanticscholar.org","Data cloud security ""VM Escape"" attack virtual machine Iaas , privacy, availability and integrity in cloud security ""VM Escape"" attack virtual machine Iaas computing: issues and current solutions",2016.0
260,… tems. Infrastructure as a Service ()  significantly lower the barrier … resources.Prolific failures have kept reliability as a foremost concern for customers consideringthe  [1]. Monitoring is especially important for  … ,1,https://www.ideals.illinois.edu/handle/2142/95458, - 2016 - ideals.illinois.edu,"Dynamic reliability and cloud security ""VM Escape"" attack virtual machine Iaas monitoring: a cloud security ""VM Escape"" attack virtual machine Iaas approach",2016.0
395,… National  Agency NSCC . . . . Network  for  Computing OpenLDAP OpenLightweight Directory Access Protocol P2P … SSL . . . . .  Sockets Layer SSO … TLS . . . . .Transport Layer  TME . . . . . Tempo Médio de Execução TMR … ,1,http://www.teses.usp.br/teses/disponiveis/55/55134/tde-28032016-144543/en.php, - 2016 - teses.usp.br,Modelos de negócio para ambientes de computação em nuvem que consideram atributos de qos relacionados a desempenho ea segurança,2016.0
226,"… These were launched as the first open-source computing toolkits for managing , 2008 …computing resources can offer significant advances in the following aspects: , reliability,compatibility … Where a  provider allows its subscribers to have total control of  … ",66,https://www.sciencedirect.com/science/article/pii/S108480451500288X,",  - Journal of Network and Computer Applications, 2016 - Elsevier","Review and analysis of networking challenges in cloud security ""VM Escape"" attack virtual machine Iaas computing",2016.0
359,… 2.5.5.16 The Lack of Knowledge and Awareness about  Behaviors and SafeInteractions with the … 2.5.6.5   ()  … Table 1. The list of dominantand most frequent   issues gathered in the literature review … ,Alle 2 versiesIn bibliotheek zoeken,http://search.proquest.com/openview/7319759342e5775e101b8b301de736c4/1?pq-origsite=gscholar&cbl=18750&diss=y,M Runiassy - 2016 - search.proquest.com,"Modeling cloud security ""VM Escape"" attack virtual machine Iaas -computing threats and vulnerabilities",2016.0
215,"… selling  services; —Hybrid : a composition of two or more  (private, community,or … advantages, as discussed in the previous section, it also introduces new  concernslinked … source of external , such as a server in the same  environment or … ",50,https://dl.acm.org/doi/abs/10.1145/2856126,",  - ACM Computing Surveys (CSUR), 2016 - dl.acm.org","Evolution of cloud security ""VM Escape"" attack virtual machine Iaas , threat models, and solutions for virtualized systems",2016.0
180,"… in a virtualized environment is a significant issue when designing a  infrastructure for …Additionally, the CyberGuarder provides VM  through the integrity verification ofapplications by … The infected VMs are those capable of spreading malware throughout the  … ",16,https://www.sciencedirect.com/science/article/pii/S0167404815001959,", ,  - Computers & , 2016 - Elsevier","Effect of anti-malware software on infectious nodes in cloud security ""VM Escape"" attack virtual machine Iaas environment",2016.0
54,"… Hey, you, get off of my : exploring information leakage in third-party compute ,” inProceedings of … Exploiting  misconfigurations including session, protocol configurationsand varied  policies … Extracting data from insecure  nodes Data processing … ",6,https://ieeexplore.ieee.org/abstract/document/7473011/,", D Evans - 2016 IEEE Symposium on Service …, 2016 - ieeexplore.ieee.org",Threat modeling for services in ,2016.0
184,… is no disagreement about the effectiveness of the data storage and the data transition techniquesof  … Table 3: / level  threats with possible solutions … Intruder adds harmfulservices into the list of  provider services that may redirect valid request to … ,4,http://159.203.248.175/index.php/npa/article/view/34,"R Kamatchi, K Ambekar, Y Parikh - Network Protocols & …, 2016 - 159.203.248.175","Mapping of a Usage Based cloud security ""VM Escape"" attack virtual machine Iaas System.",2016.0
62,"… to the presence of multi-tenants in a  environment, resources (ie, servers, , storage)are … These  vulnerabilities represent some of the most significant obstacles to the adoptionof … data to , administrators need to ensure that all data in  are completely … ",38,https://www.researchgate.net/profile/Tariqul_Islam16/publication/308172311_A_Classification_and_Characterization_of_Security_Threats_in_Cloud_Computing/links/57dc38cf08aeea195935c51f/A-Classification-and-Characterization-of-Security-Threats-in-Cloud-Computing.pdf,", , S Zeadally - Int. J. Next-Gener. Comput, 2016 - researchgate.net","A classification and characterization of cloud security ""VM Escape"" attack virtual machine Iaas threats in cloud security ""VM Escape"" attack virtual machine Iaas computing",2016.0
58,"… Frameworks for  migration have been introduced like PALM (Protection aegis for livemigration of VMs), that keeps the …  of   images in a  environment,"" inProceedings of the 2009 ACM workshop on  computing , 2009, pp … ",7,https://ieeexplore.ieee.org/abstract/document/7821971/,"O AbdElRahem, … - 2016 11th International …, 2016 - ieeexplore.ieee.org","Virtualization cloud security ""VM Escape"" attack virtual machine Iaas : A survey",2016.0
186,"… JoUini, L.Ben arfa Rabai, SUrveying and analyzing  Problems in  CompUtingEnvironments, in: CompUtational Intelligence and  (CIS), 2014 … V. Dastjerdi, K. a. BaNar,SGH Tabatabaei, DistribUted IntrUsion Detection in  Using Mobile … ",27,https://www.sciencedirect.com/science/article/pii/S1877050916302824,"Z Chiba, N Abghour, K Moussaid, M Rida - Procedia Computer Science, 2016 - Elsevier","A cooperative and hybrid network intrusion detection framework in cloud security ""VM Escape"" attack virtual machine Iaas computing based on snort and optimized back propagation neural network",2016.0
171,"… ""Challenges and opportunities for virtualized  in the ."" Proceedings of the 14thACM symposium on Access control models and technologies. ACM, 2009 … ""Enhancing DataDynamics and Storage  for  Computing using Merkle … ""A  Analysis of … ",2,https://dl.acm.org/doi/abs/10.1145/2905055.2905098,", , BS Nayak - Proceedings of the Second …, 2016 - dl.acm.org","Cha-Cha 20: stream cipher based encryption for cloud security ""VM Escape"" attack virtual machine Iaas data centre",2016.0
57,"… For protecting  against stepping-stone , a VM introspection based mechanism isprovided in … operating system thus results in exposing the newly created VM to  threats …As the  systems use virtualization, the tasks are executed on   which … ",132,https://www.sciencedirect.com/science/article/pii/S1084804516301060,"MA Khan - Journal of network and computer applications, 2016 - Elsevier","A survey of cloud security ""VM Escape"" attack virtual machine Iaas issues for cloud security ""VM Escape"" attack virtual machine Iaas computing",2016.0
52,"… which tries to optimize the placement of  infrastructures according to user-specified criteriaacross multiple  … Schemes, SLA Support, , Environment, Algorithm type … factorswhich have been considered in these schemes to achieve more green  computing … ",132,https://www.sciencedirect.com/science/article/pii/S1084804516000291,", SS Nabavi, V Ahmadi - Journal of Network and Computer …, 2016 - Elsevier","An overview of cloud security ""VM Escape"" attack virtual machine Iaas placement schemes in cloud security ""VM Escape"" attack virtual machine Iaas computing",2016.0
32,"… with keywords and related concepts that were used during interviews are:   systems, … Threat 06 ( ): This threat affects infrastructure () by exploiting hypervisorto take … In the process we extracted more than 70   papers and research … ",40,https://www.sciencedirect.com/science/article/pii/S1877050916318257,"N Khan, A Al-Yasiri - Procedia Computer Science, 2016 - Elsevier","Identifying cloud security ""VM Escape"" attack virtual machine Iaas threats to strengthen cloud security ""VM Escape"" attack virtual machine Iaas computing adoption framework",2016.0
25,"… Wen, F., & Xiang, L. (2011, December). The study on data  in  Computing basedon Virtualization … 2, pp. 257- 261). IEEE. Zhao, S., Chen, K., & Zheng, W. (2009, August). logging for auditable file system using separate   … ",15,https://www.igi-global.com/article/analyzing-virtualization-vulnerabilities-and-design-a-secure-cloud-environment-to-prevent-from-xss-attack/144185,"N Nagar,  - International Journal of Applications and …, 2016 - igi-global.com","Analyzing virtualization vulnerabilities and design a cloud security ""VM Escape"" attack virtual machine Iaas environment to prevent from XSS ",2016.0
51,"… 3] M. a. AlZain, E. Pardede, B. Soh, and J. a. Thom, “ computing : From single tomulti-,” Proc … Fan, D. Mao, Z. Lu, and J. Wu, “OPS: Offline patching scheme for the imagesmanagement in a   environment,” Proc … 28]   Alliance, “ … ",5,https://ieeexplore.ieee.org/abstract/document/7796151/,", , … - … on smart  …, 2016 - ieeexplore.ieee.org","A framework to cloud security ""VM Escape"" attack virtual machine Iaas the cloud security ""VM Escape"" attack virtual machine Iaas image in cloud security ""VM Escape"" attack virtual machine Iaas computing",2016.0
35,"… So, after identifying the threats and vulnerabilities there are various ways to  the  … Theencryption methods and various devices are being used for the  like firewalls and intrusiondetection systems which can further protect the  system. Page 7 … ",2,https://www.academia.edu/download/46484247/v4i516.pdf,"D Nagpal,  - International journal of research in computer …, 2016 - academia.edu","Survey on threats cloud security ""VM Escape"" attack virtual machine Iaas and implementation of cloud security ""VM Escape"" attack virtual machine Iaas in cloud security ""VM Escape"" attack virtual machine Iaas infrastructure",2016.0
34,"…  federation, Multi-, Utility computing, Inter-, cross-, 2014 … Chen et al., 2013,Khan et al., 2014, Khan et al., 2016), Internet  problems remain the …  providers usehypervisor and VM technologies in  multi-tenant environment which consists of … ",95,https://www.sciencedirect.com/science/article/pii/S1084804516301771,", , B Dhaghighi, … - Journal of Network and …, 2016 - Elsevier","On cloud security ""VM Escape"" attack virtual machine Iaas : A taxonomy and intrusion detection and prevention as a service",2016.0
176,"… Doctoral dissertation, University of Southampton (2013)Google Scholar. Chang, V., Kuo,Y.-H., Ramachandran, M.:  computing adoption framework–a  frameworkfor business . Future Gener. Comput. Syst. 57, 24–41 (2015) … ",5,https://link.springer.com/chapter/10.1007/978-3-319-54380-2_11,", , G Ghashgari… - … on Enterprise , 2015 - Springer","in organisations: governance, risks and vulnerabilities in moving to the ",2015.0
164,"… [8] M. Aslam, C. Gehrmann, and M. Bjorkman, “ and trust preserving vm migrations inpublic ,” in Trust,  and Privacy in … M. Villari, and A. Puliafito, “A remote attestationapproach for a    migration in federated  environments,” in … ",1,https://epub.uni-regensburg.de/32375/,", , ,  - 2015 - epub.uni-regensburg.de","Qos-aware cloud security ""VM Escape"" attack virtual machine Iaas live migration of ",2015.0
145,"… [24] T. Ristenpart, E. Tromer, H. Shacham, and S. Savage, “Hey, You, Get Off of my :Exploring Information Leakage in Third-Party Compute ,” in Proceedings of the 16thACM conference on Computer and communications , pp … ",24,https://ieeexplore.ieee.org/abstract/document/7431476/,", , … - … on Utility and  …, 2015 - ieeexplore.ieee.org","Vehicular cloud security ""VM Escape"" attack virtual machine Iaas networks: Architecture, applications and cloud security ""VM Escape"" attack virtual machine Iaas issues",2015.0
310,"… configured, deployed, to be managed dynamically expanded for take complete controlof  … to a huge rise of  computing in the modern era … Virtualization is a conceptthat greatly attributes to the  implications in the environment … ",1,http://publications.polymtl.ca/1916/,H Abbasi - 2015 - publications.polymtl.ca,"Detecting Specific Types of DDoS cloud security ""VM Escape"" attack virtual machine Iaas in cloud security ""VM Escape"" attack virtual machine Iaas Environment by Using Anomaly Detection",2015.0
11,"… Organizations are using virtualization in private, public and hybrid  to gain efficiency in …Therefore, the physical  environment must be prevented from insider  … hypervisorarchitecture for XEN, offers isolation of VM systems with flexible  of mandatory … ",5,https://link.springer.com/chapter/10.1007/978-3-319-25988-8_4,", SY Zhu - Guide to Assurance for Computing, 2015 - Springer","Virtualization cloud security ""VM Escape"" attack virtual machine Iaas in cloud security ""VM Escape"" attack virtual machine Iaas computing",2015.0
251,"… the different deployment methods the service models can have implications for a  state, it … efficient resource sharing, this increases the cost and reduces the flexibility of computing … When managing these aspects of  one main issue is the lack of control … ",7,http://www.diva-portal.org/smash/record.jsf?pid=diva2:825307,"A Backe, H Lindén - 2015 - diva-portal.org","computing cloud security ""VM Escape"" attack virtual machine Iaas : a systematic literature review",2015.0
64,…  Intrusion Detection System Service (CIDSS) architecture is built for   SaaSapplication data … The solution is to follow the WS- policy to protect against XML Signature … provider is only responsible for deploying NIDS in the  environment and … ,6,http://search.proquest.com/openview/b6481c1d8efc1bcc3a455cea189bcce3/1.pdf?pq-origsite=gscholar&cbl=2035011,",  - the international journal of science …, 2015 - search.proquest.com","A study on securing cloud security ""VM Escape"" attack virtual machine Iaas environment from DDoS cloud security ""VM Escape"" attack virtual machine Iaas to preserve data availability",2015.0
59,"… A. Nayak, “Decentralized access control with anonymous authentication of data stored in ,”Parallel and … spoofed ddos traffic,” in Proceedings of the 10th ACM conference on Computer andcommunications  … [19] A. Bakshi and B. Yogesh, “Securing  from ddos … ",49,https://derby.openrepository.com/handle/10545/620916,", SY Zhu - 2015 - derby.openrepository.com","A survey on top cloud security ""VM Escape"" attack virtual machine Iaas threats in cloud security ""VM Escape"" attack virtual machine Iaas computing",2015.0
133,"… We Need One  Strategy or Vendor  Is Less  Than On … as the Certificate of  Knowledge (CCSK) or the Certified   Professional (CCSP … VMwareVirtualization for Desktop & Server, Application, Public & Hybrid | United States … ",1,https://books.google.nl/books?hl=nl&lr=&id=tPVnCwAAQBAJ&oi=fnd&pg=PA16&dq=cloud+security+%22VM+Escape%22+attack+virtual+machine+Iaas&ots=NSZ5IbVbjd&sig=MUB_ggCrZfTaiYZZkGznebAnGvo,"JM Brook, R Brooks - … International Conference on  …, 2015 - books.google.com","A decade of lessons learned: Transforming the enterprise for todays cloud security ""VM Escape"" attack virtual machine Iaas architecture",2015.0
110,"… 495-500. [3] Hui Suo, Zhuohua Liu, Jiafu Wan and Keliang Zhou, "" and privacy in mobile computing,"" in … 655-659. [4] S. Scott-Hayward, G. O'Callaghan and S. Sezer, ""Sdn :A survey … 1-7. [5] ""Building  telco  (white paper),"" Nokia Networks, Tech … ",8,https://ieeexplore.ieee.org/abstract/document/7368308/,"M Monshizadeh, , L Hippeläinen… - … Information  …, 2015 - ieeexplore.ieee.org","Cloudification and cloud security ""VM Escape"" attack virtual machine Iaas implications of TaaS",2015.0
189,"… In [64], the concept of tenant- ID is introduced on the data-link layer to securely seg- ment, isolateand identify tenants and their assets in the . The authors in [65] propose a  modeland a set of principles to  logical isolation between tenant resources in a … ",48,https://pdfs.semanticscholar.org/3385/b800ace9d03f0e8258ab90dcf5687808b0e5.pdf,", , , … - Journal of Computing …, 2015 - pdfs.semanticscholar.org","A survey of cloud security ""VM Escape"" attack virtual machine Iaas and privacy challenges in cloud security ""VM Escape"" attack virtual machine Iaas computing: solutions and future directions",2015.0
4,… An in-VM measuring framework for increasing    in was given in [25] … Revenue at   side can be increased by providingcompetitive rates using COMMA policy as proposed in [27] … ,6,https://pdfs.semanticscholar.org/2cb3/3b33859dbc1607a128c2a27029f1b3906695.pdf,", DS Bhilare - International journal of …, 2015 - pdfs.semanticscholar.org",SAFETY: A framework for ,2015.0
117,"… Abuse of  services was the most common threat in  computing in 2010, but different measures were introduced to prevent it … 4. What are the key differences between the in three-tier architecture of VCN … What are the main stages in data life cycle in  … ",2,https://link.springer.com/chapter/10.1007/978-3-319-25988-8_12,", ,  - Guide to Assurance for  …, 2015 - Springer","Vehicular cloud security ""VM Escape"" attack virtual machine Iaas networks: Architecture and ",2015.0
155,"… identity and access management etc) and  issues in virtualization (  etc … 35]Bugiel, Sven, S. Nürnberger, A. -Reza Sadeghi, T. Schneider., “Twin :  computing with low latency,” In Communications and Multimedia , Springer Berlin … ",8,https://www.researchgate.net/profile/Muhammad_Sharif9/publication/289672661_Cloud_Computing_Security_Models_Architectures_Issues_and_Challenges_A_Survey/links/56914aba08ae0f920dcb6daa/Cloud-Computing-Security-Models-Architectures-Issues-and-Challenges-A-Survey.pdf,",  - SmartCR, 2015 - researchgate.net","computing cloud security ""VM Escape"" attack virtual machine Iaas models, architectures, issues and challenges: A survey",2015.0
41,"… A successful    can provide access to the computing and storage hardware … Thesecomponents embedded in the  architecture to provide   computing … CAS ProposedThreats There are also some threats, stated by   Alliance, which … ",6,https://pdfs.semanticscholar.org/d765/432eaf890f1e9d3f9cf621cc08474e4e8a74.pdf,"VK Veeramachaneni - Int. J. Eng. Sci. Innov. Technol, 2015 - pdfs.semanticscholar.org","Issues and Countermeasures in cloud security ""VM Escape"" attack virtual machine Iaas Computing Environment",2015.0
82,"… The participating  share a standardized technology though retaining their unique entitystatus …   services. Before analyzing the various  challenges faced by the servicemodels, it is important to know the relationships and dependencies these models … ",7,https://ieeexplore.ieee.org/abstract/document/7489088/,"S Srivastava,  - 2015 39th National Systems …, 2015 - ieeexplore.ieee.org","in cloud security ""VM Escape"" attack virtual machine Iaas computing systems: A review of challenges and solutions for cloud security ""VM Escape"" attack virtual machine Iaas in distributed computing environments",2015.0
262,"… memory and CPU [12]. Due to heterogeneity of   resources, the risk of data leakagevaries among the  providers. The  vulnerabilities of a  system are considered specific if they result from core  computing technologies … ",3,http://search.proquest.com/openview/c8426835d15b12402cc9fc4cf76cf9ed/1?pq-origsite=gscholar&cbl=18750&diss=y,AA Almutairi - 2015 - search.proquest.com,"Risk-aware cloud security ""VM Escape"" attack virtual machine Iaas resource management for access controlled cloud security ""VM Escape"" attack virtual machine Iaas data centers",2015.0
225,… either by using different  providers or different private  for a … 25] have proposed an surface metric that measures the  of software … AL.: RISK-AWARE MANAGEMENT OF RESOURCES IN ACCESS CONTROLLED SERVICE-ORIENTED  … ,17,https://ieeexplore.ieee.org/abstract/document/7152855/,"A Almutairi, , A Ghafoor - IEEE Transactions on  …, 2015 - ieeexplore.ieee.org","Risk-aware management of cloud security ""VM Escape"" attack virtual machine Iaas resources in access controlled service-oriented cloud security ""VM Escape"" attack virtual machine Iaas datacenters",2015.0
197,… physical  provided to  the facilities; but it is possible with an insider  … leadto the compromise of VMs(D) of merchant A through VM-to-  or exploitation … The researchby   Alliance (CSA) [16] highlights some top threats to  computing … ,1,https://concordia.ab.ca/wp-content/uploads/2017/04/OlajideP.pdf,"P Olajide, P Zavarsky, … - Retrieved online on 23rd …, 2015 - concordia.ab.ca",PCI DSS Compliance Validation of Different Levels of Merchants in a Multi-tenant Private ,2015.0
344,"… Distributed Denial of Service (DDoS) or to gain unauthorized resources from the . To protectVMs in public , where  system administrators usually have full … of  issuesin the  system is that of VM interconnection [22]. The possible … ",3,https://repository.asu.edu/attachments/158040/content/Chung_asu_0010E_15260.pdf, - 2015 - repository.asu.edu,"SDN-based Proactive Defense Mechanism in a cloud security ""VM Escape"" attack virtual machine Iaas System",2015.0
267,"… Lack of trust narrows down the potential high usage of the  … are being continuously detectedlike; Theft-of-Service , Denial of Service (DoS) ,  malware injection … Hence, whatneeded is that the service providers should be aware of  problems; they … ",11,https://link.springer.com/article/10.1007/s11277-015-2729-z,", MMZE Mohammed - wireless personal communications, 2015 - Springer","Building Customer trust in cloud security ""VM Escape"" attack virtual machine Iaas computing with an ICT-enabled global regulatory body",2015.0
396,"… challenges, including . We need to see if traditional ways of securing a … ζώνης και εικονικέςµηχανές ( ). Ταχεία ελαστικότητα (rapid elasticity) : Οι πόροι αυτοί µπορούν µεπολύ … Νέφος υποδοµής ως µια υπηρεσία ( Infrastructure as a Service … ",HTML-versie,http://dione.lib.unipi.gr/xmlui/handle/unipi/6365,ΠΣ Σκαμάγκας - 2015 - dione.lib.unipi.gr,Συστήματα ανίχνευσης εισβολών σε περιβάλλον υπολογιστικού νέφους,2015.0
71,"… [9] PHAM, C., ESTRADA, Z., CAO, P., KALBARCZYK, Z., AND IYER, R. Reliability and monitoring of … RISTENPART, T., TROMER, E., SHACHAM, H., AND SAVAGE, S. Hey, you, getoff of my : exploring information leakage in third-party compute  … ",27,https://www.usenix.org/conference/woot15/workshop-program/presentation/wang,"G Wang, , , Z Kalbarczyk… - 9th {USENIX} Workshop …, 2015 - usenix.org","Hypervisor introspection: a technique for evading passive cloud security ""VM Escape"" attack virtual machine Iaas monitoring",2015.0
236,"… IEEE, 2011. [29] T. Ristenpart, E. Tromer, H. Shacham, S. Savage, “Hey, you, get of my :exploring information lea age in third-party compute .” in Proceedings of the 16th ACMconference on Computer and Communications , ACM, pp … ",11,https://ieeexplore.ieee.org/abstract/document/7281975/,"M Graham, A Winckles… - 2015 IEEE 13th …, 2015 - ieeexplore.ieee.org","Botnet detection within cloud security ""VM Escape"" attack virtual machine Iaas service provider networks using flow protocols",2015.0
105,"… issues such as  , VM hopping, Hyperjacking and so on. I will refer to … Virtualization'sImpact on  ” By; Hsin-Yi Tsai … [SLR4]  Virtualization and Multicore PlatformsState-of-the- Art report, By: Heradon Douglas and Christian Gehrmann … ",2,http://www.diva-portal.org/smash/get/diva2:1022020/FULLTEXT02,A Mahjani - 2015 - diva-portal.org,"issues of virtualization in cloud security ""VM Escape"" attack virtual machine Iaas computing environments",2015.0
