,abstract,citations,link,reference,title,year
305,"… description 5; 230000015654 memory Effects 0 description 43; 239000008264  Substances0 … or power-downs, version controls, system software checks,  updates or … G06F21/577—Assessing vulnerabilities and evaluating computer system . G—PHYSICS; … ",Alle 2 versiesIn cache,https://patents.google.com/patent/US20190370482A1/en,"JA Harland, V Patel, N Pritchard - US Patent App. 16/539,580, 2019 - Google Patents",message handling,2019.0
298,US20190155597A1 - Zero Down Time Upgrade for a Multi-Tenant Identity and Data Management  Service - Google Patents. Zero Down Time Upgrade for a Multi-Tenant Identityand Data  Management  Service. Download PDF Info … ,Alle 2 versiesIn cache,https://patents.google.com/patent/US20190155597A1/en,"V Lander,  - US Patent App. 16/254,761, 2019 - Google Patents","Zero Down Time Upgrade for a Multi-Tenant Identity and Data cloud security VM ""rollback"" attack virtual machine IaaS Management cloud security VM ""rollback"" attack virtual machine IaaS Service",2019.0
351,"… through network 140, as is common in data centers and with -computing applications …Transactional messaging—similar servers; Non-persistent messaging—high capacity networklinks;  Socket Layer (SSL) and encryption—dedicated  hardware; … ",Alle 2 versiesIn cache,https://patents.google.com/patent/US20190068480A1/en,"GD Hopkins, TJ Quigly, LDC Saker… - US Patent App. 16 …, 2019 - Google Patents",Management of connections of a client application including server selection,2019.0
149,"… are often used by researchers, for instance the title of articles “ virtualization for … target asit is still contains many flaws such as   , data leakage … into  computingsignificantly increases  surface and further complicates   activities [34 … ",1,https://link.springer.com/chapter/10.1007/978-3-030-10543-3_14,"LS Thiam, ,  - … of Big Data and IoT , 2019 - Springer",Bibliometric analysis on the rise of ,2019.0
366,… Patents. Monitoring connectivity and latency of a  network. Download PDF Info …10; 239000008264  Substances 0 description 9; 230000036541 health Effects0 description 8; 238000001914 filtration Methods 0 description 7; … ,Alle 2 versiesIn cache,https://patents.google.com/patent/US20190363965A1/en,"R Tewari, , HK Chandrappa… - US Patent App. 16 …, 2019 - Google Patents","Monitoring connectivity and latency of a cloud security VM ""rollback"" attack virtual machine IaaS network",2019.0
315,"… The  OS/VMM 128 may include a  Integrity Technology (CIT) agent 130 … 5-8 , the cloudlet102 may perform a  and trusted boot process … Multiple ones of the  componentsdiscussed herein may be leveraged during this boot process, as discussed in detail … ",4,https://patents.google.com/patent/US10339317B2/en,"Y Raghuram, , NT Cook, K Sood - US Patent 10,339,317, 2019 - Google Patents",Computing devices,2019.0
170,"… Here we assume that a  image launched to the hypervisor is  … allows remote attackersto gain access by connecting to the VNC server (CVE-2015-3252).” “BIG-IP and BIG-IQ AWS,Azure, or Verizon  instances do … 2.2.1  Challenges to  in Running State … ",4,https://dl.acm.org/doi/abs/10.1145/3287306,",  - ACM Computing Surveys (CSUR), 2019 - dl.acm.org","An exhaustive survey on cloud security VM ""rollback"" attack virtual machine IaaS concerns and solutions at different components of virtualization",2019.0
384,"… services to various end hosts, which may include physical  and/or  () … applications such as campus networks, virtualized data centers (VDCs), private ,and the … via the command include, eg, ACL rules that are used for  purposes, rules … ",19,https://patents.google.com/patent/US10193706B2/en,"S Bhattacharya, R Hansalia, R Muddana… - US Patent …, 2019 - Google Patents",Distributed rule provisioning in an extended bridge,2019.0
385,"… to support (i) generic resource management for any type of workload and (ii) provisioning of resources from multiple   … includes an assessment of other functional aspects suchas cluster setup tools,  networking, customizability,  and multi … ",3,https://www.mdpi.com/2076-3417/9/5/931,", , , … - Applied Sciences, 2019 - mdpi.com",A comprehensive feature comparison study of open-source container orchestration frameworks,2019.0
395,"… Because it is highly performant,  and open sourced, Blockchain use cases built withHyperledger … to easily set up and manage a permissioned blockchain hosted in the  withpreassembled components and enterprise-grade  and performance … ",Alle 2 versiesIn bibliotheek zoeken,https://books.google.nl/books?hl=nl&lr=&id=iGuuDwAAQBAJ&oi=fnd&pg=PP1&dq=cloud+security+VM+%22rollback%22+attack+virtual+machine+IaaS&ots=h61BmQdVu5&sig=l0UeIV_nZjFXsEIwvCeLtre-fRI,"V Acharya, AE Yerrapati, N Prakash - 2019 - books.google.com",Oracle Blockchain Quick Start Guide: A practical approach to implementing blockchain in your enterprise,2019.0
164,"… To solve the problems that were pointed out in this survey, this paper endeavors to develop anew  architecture by …  Comput. (2016). Google Scholar. [7] Yang S., Wieder P.,Yahyapour R., Trajanovski S., Fu X.Reliable   placement and routing in  … ",3,https://www.sciencedirect.com/science/article/pii/S0167739X18324208,"Sivagami, KS Easwarakumar - Future Generation Computer Systems, 2019 - Elsevier","An improved dynamic fault tolerant management algorithm during cloud security VM ""rollback"" attack virtual machine IaaS migration in cloud security VM ""rollback"" attack virtual machine IaaS data center",2019.0
214,"… by a constellation of networked apparatuses, in a distributed processing or -basedarchitecture … information that shares a  policy as a uniform  domain … viaimplementation of network and device communications, adaptation of  communication … ",4,https://patents.google.com/patent/US10210333B2/en,"IIWD Smith, SNU Ahmed, J Czechowski III… - US Patent …, 2019 - Google Patents",industrial control platform,2019.0
26,"… 11] Z. Chen, F. Han, J. Cao, X. Jiang, S. Chen, “ computing- based forensic analysis forcollaborative network  management system … K. Kourai, T. Azumi, and S. Chiba, “Aself-protection mechanism against stepping-stone  for  ”, in Ubiquitous … ",3,https://ieeexplore.ieee.org/abstract/document/8776897/,", M Saran, R Kumar - … Conference on  …, 2019 - ieeexplore.ieee.org","A survey on cloud security VM ""rollback"" attack virtual machine IaaS over sensor-",2019.0
60,"… To guide future research, we discussed generalized  measures and requirementsto be taken to achieve  virtualized implementations …  providers, -as-a-service based on  introspection and ensures the best  [8] … ",1,https://link.springer.com/article/10.1007/s41870-019-00294-x,", A Aggarwal,  - International Journal of Information …, 2019 - Springer","Virtualization vulnerabilities, cloud security VM ""rollback"" attack virtual machine IaaS issues, and solutions: a critical study and comparison",2019.0
55,"…  Agency (ENISA) reported that Dropbox (a large -storage service) was by DDoS … In general, this research is based on the information exchange between . Every is loaded with its own IDS, so if one is under , then the cooperative IDS … ",1,http://www.academia.edu/download/59222973/05_Paper_31031920_IJCSIS_Camera_Ready_pp67-9020190512-80804-19u1ak0.pdf,"L Alhenaki, A Alwatban, B Alahmri… - … and Information  …, 2019 - academia.edu","in cloud security VM ""rollback"" attack virtual machine IaaS computing: A survey",2019.0
165,"… Although there are many open source  such as Eucalyptus, CloudStack, OpenStack, andOpenNebula … for author's keyword search, the search string will be “Trusted Computing'' AND' Computing' … as an SW-based vTPM does not offer the same  properties as … ",2,https://www.sciencedirect.com/science/article/pii/S0167404818302712,"FAM Ibrahim,  - Computers & , 2019 - Elsevier","Trusted cloud security VM ""rollback"" attack virtual machine IaaS computing architectures for infrastructure as a service: Survey and systematic literature review",2019.0
52,"… Monitoring  from the  (C2): The most sig- nificant issue is to  the  rather thanmonitoring …  awareness is a  concern that is often overlooked49. The misuse ofopen  services by users often allows an attacker to access the system, so users … ",1,https://www.researchgate.net/profile/Khalil_Al-Shqeerat/publication/331197914_A_Taxonomy_of_Virtualization_Security_Issues_in_Cloud_Computing_Environments/links/5c6b997592851c1c9deaae6b/A-Taxonomy-of-Virtualization-Security-Issues-in-Cloud-Computing-Environments.pdf,"NM Almutairy, … - Indian Journal of …, 2019 - researchgate.net","A Taxonomy of Virtualization cloud security VM ""rollback"" attack virtual machine IaaS Issues in cloud security VM ""rollback"" attack virtual machine IaaS Computing Environments",2019.0
337,… disclosure(s) are submitted under 35 USC 102(b)(1)(A): “ Yet Usable … 9 depicts a computing environment according to some embodiments of the present … executing  policiesassociated with each execution environment (because each  policy contains … ,1,https://patents.google.com/patent/US20190036978A1/en,", S Regev, R Peleg… - US Patent App. 15 …, 2019 - Google Patents",Intrusion detection and mitigation in data processing,2019.0
281, system for managed computer system. Download PDF Info … A US201816112648 A US201816112648A US 2019068622 A1 US2019068622 A1 US 2019068622A1 Authority US UnitedStates Prior art keywords manager  alarms process  Prior art … ,Alle 2 versiesIn cache,https://patents.google.com/patent/US20190068622A1/en,"LIN Peixiao, A Chopra, DG Wing, V Ganti… - US Patent App. 16 …, 2019 - Google Patents",system for managed computer system,2019.0
137,"… The individual  hold their individual identity, but interfaces for application and data portabilitybetween themselves are provided … Platform layer • Provide secured application developmentand execution environment to  users … Follow the -aware software … ",1,http://search.proquest.com/openview/66665ae705198eee3f12585401b42130/1?pq-origsite=gscholar&cbl=25782,", R Goyal - Software Quality Professional, 2019 - search.proquest.com","Assurance of Data cloud security VM ""rollback"" attack virtual machine IaaS and Privacy in the cloud security VM ""rollback"" attack virtual machine IaaS : A Three-Dimensional Perspective",2019.0
30,"… Multi-tenancy is another feature unique to , especially in public  … in the  andprovides situational awareness through continuous monitoring of the   [29] … prototypewas based on firewall technology and authors revealed that the  policies are … ",1,https://link.springer.com/article/10.1007/s41870-018-0108-1,"A Singh - International Journal of Information Technology, 2019 - Springer","concerns and countermeasures in cloud security VM ""rollback"" attack virtual machine IaaS computing: a qualitative analysis",2019.0
339,"… 239000008264  Substances 0 description 18; 238000004891 communication Methods0 claims … These data centers provide physical  for these resources, protecting … DETAILEDDESCRIPTION; Conventional  computing systems typically locate storage and … ",Alle 2 versiesIn cache,https://patents.google.com/patent/US20190311127A1/en,"Y Raghuram, SM Balle, NT Cook… - US Patent App. 16 …, 2019 - Google Patents",Computing devices,2019.0
120,"… which can be treated as suspicious are, over resource consumption, violation of  policies,an … They have customized the existing Provenance Aware Storage System (PASS) to suit the requirements … This may not be always possible as the user of a  may not be … ",1,https://www.sciencedirect.com/science/article/pii/S0167404818301895,",  - Computers & , 2019 - Elsevier","SNAPS: Towards building snapshot based provenance system for cloud security VM ""rollback"" attack virtual machine IaaS in the cloud security VM ""rollback"" attack virtual machine IaaS environment",2019.0
130,… The report on open ports is given to a   administrator … W7. Windows-7.  Server3.8*1.2 TB. 64 GB … Vulnerability patching is implemented using  Shell (SSH) where theproposed framework uses the Java  channel API to execute SSH commands … ,1,https://link.springer.com/article/10.1007/s11227-018-2698-6,",  - The Journal of Supercomputing, 2019 - Springer","Designing an efficient framework for vulnerability assessment and patching (VAP) in cloud security VM ""rollback"" attack virtual machine IaaS environment of cloud security VM ""rollback"" attack virtual machine IaaS computing",2019.0
43,"… Tari Z (2014)  and Privacy in  Computing. IEEE  Computing 1(1):54–57 … SelvamL, Kumar PM, Renjith JA (2014) Encryption-based  sharing of data with fine-grained accesscontrol in public . Journal of Applied  Research … ",1,https://link.springer.com/article/10.1007/s11036-019-01261-3,"L Joseph, R Mukesh - Mobile Networks and Applications, 2019 - Springer","Securing and Self recovery of cloud security VM ""rollback"" attack virtual machine IaaS in cloud security VM ""rollback"" attack virtual machine IaaS with an Autonomic Approach using Snapshots",2019.0
330,… These metadata files contain SAML attributes (or certificates) for  authentication betweenthe … The on-boarding enterprise users with a  provider may lead to duplication of … SSO productssuffers from limited authentication requests and non- versatile  tokens … ,Alle 2 versiesHTML-versie,http://www.diva-portal.org/smash/record.jsf?pid=diva2:1316547,T Kodam - 2019 - diva-portal.org,A roadmap for ensuring SAML authentication using Identity server for on-premises and ,2019.0
111,"… Most public  are sh- ared environments; it is critical to ensure that hosting providers can …With that being said, a hypervisor based solution secures ONLY a specific  group; if the … Hence,while using the hypervisor to monitor  within the , hack- ers may find a … ",6,https://www.udspub.com/ajj/public/index.php/jsc/article/view/67,"A Giannakoulias - Journal of Smart Cities, 2019 - udspub.com","computing cloud security VM ""rollback"" attack virtual machine IaaS : protecting cloud security VM ""rollback"" attack virtual machine IaaS -based smart city applications",2019.0
273,"… erasure; Buffer overflow by executing in a restricted environment, eg sandbox or   … 8 depicts a representative  computing environment in which exemplary aspectof …  computing resources and certain capabilities that must be dropped for  … ",Alle 2 versiesIn cache,https://patents.google.com/patent/US20190068641A1/en,", , … - US Patent App. 15 …, 2019 - Google Patents",Application-level sandboxing,2019.0
279,"… For example, there could be several  private , elastic load balancers, with severalhundred … running software application(s) such as  elastic compute, storage, network, groups, routing … For example, if  block storage 408 with 100 GB is attached to a … ",Alle 2 versiesIn cache,https://patents.google.com/patent/US20190171966A1/en,"G Rangasamy - US Patent App. 16/207,089, 2019 - Google Patents","Automated application reliability management using adaptable cloud security VM ""rollback"" attack virtual machine IaaS learning models",2019.0
34,"… doi:10.1016/j.ins.2013.04.028 5. Alzain, MA, Pardede, E., Soh, B., & Thom, JA (2012). Computing : From Single to Multi-. 2012 45th Hawaii InternationalConference on System Sciences. doi:10.1109/hicss.2012.153 … ",1,https://www.dpublication.com/wp-content/uploads/2018/12/RST-7-135.pdf,"T Atobishi, S Podruzsik, SZ Gabor - 2018 - dpublication.com","A review of the cloud security VM ""rollback"" attack virtual machine IaaS challenges in the cloud security VM ""rollback"" attack virtual machine IaaS computing",2018.0
386,… Dumpster diving 1 ■ Shoulder surfing 1 ■ Hoax 1 ■ Watering hole  1 ■ Principles …Bluejacking 1 ■ Bluesnarfing 1 ■ RFID 1 ■ NFC 1 ■ Disassociation 1 Cryptographic 1 ■ Birthday 1 … 2 Router 2 ■ ACLs 2 ■ Antispoofing 2 Switch 2 ■ Port  2 ■ Layer 2 … ,Alle 3 versiesIn bibliotheek zoeken,https://books.google.nl/books?hl=nl&lr=&id=hq1UDwAAQBAJ&oi=fnd&pg=PP1&dq=cloud+security+VM+%22rollback%22+attack+virtual+machine+IaaS&ots=dx345OZANn&sig=8vQbXmbmxxG5mCX4A_8xyudSgS0,"SR Christy,  - 2018 - books.google.com",CompTIA Security+ Practice Tests: Exam SY0-501,2018.0
320,"… Yan et al. [18] then went on to propose initial solutions to a number of the identified  andprivacy problems … Florin et al. [22] introduced military vehicle  (MVCs), a … Citation information:DOI 10.1109/TCC.2018.2834352, IEEE Transactions on  Computing 3 III … ",4,https://ieeexplore.ieee.org/abstract/document/8356038/,", , AG Zadeh… - … on  …, 2018 - ieeexplore.ieee.org",A tight estimate of job completion time in vehicular ,2018.0
342,… data Benefits Cons Fit for purpose The role of  Summary Chapter 4 … cluster Connectingto the Service Fabric party cluster Azure  functions Environment … HTTP methods Authenticationand authorization Endpoint redirection Content negotiation  API modeling … ,1,https://books.google.nl/books?hl=nl&lr=&id=CulODwAAQBAJ&oi=fnd&pg=PP1&dq=cloud+security+VM+%22rollback%22+attack+virtual+machine+IaaS&ots=111ddboCSe&sig=zSfzotASRAyBZYDBqWIi9v8VzyU,"A Mahajan, ,  - 2018 - books.google.com","-Native Applications in Java: Build microservice-based cloud security VM ""rollback"" attack virtual machine IaaS -native applications that dynamically scale",2018.0
348,… 2016-03-21 Assigned to INTERNATIONAL BUSINESS  CORPORATION reassignmentINTERNATIONAL BUSINESS  CORPORATION ASSIGNMENT … 7; 238000004891communication Methods 0 claims description 3; 239000008264  Substances 0 … ,2,https://patents.google.com/patent/US10129130B2/en,"GD Hopkins, TJ Quigly, LDC Saker, CH Stirling… - US Patent …, 2018 - Google Patents",Management of connections of a client application including server selection,2018.0
20,"… An architecture for  active monitoring using virtualization”,Proc 29th IEEE symposium privacy PP … Thomas, Eran Tromer, Hovav Shacham, Stefan Savage ”Hey,you Get off my: Exploring Information leakage in third party compute ,” proc.16 … ",2,https://hrcak.srce.hr/205758,"L Joseph, R Mukesh - 2018 - hrcak.srce.hr","Detection of malware cloud security VM ""rollback"" attack virtual machine IaaS on cloud security VM ""rollback"" attack virtual machine IaaS for a self-heal approach in cloud security VM ""rollback"" attack virtual machine IaaS computing using cloud security VM ""rollback"" attack virtual machine IaaS snapshots",2018.0
363,"… like computing, com- munication, and storage technologies, namely resource man- agement,, and privacy … On the other hand, datacenters are the main physical components of  …The convergence of mobile  computing is predicated on a reliable, end- to-end … ",57,https://ieeexplore.ieee.org/abstract/document/8444370/,", , … - IEEE …, 2018 - ieeexplore.ieee.org","Fog Computing: Survey of trends, architectures, requirements, and research directions",2018.0
18,"… of cost and scaling like public , while the  and control of private  are also …full access at the backend to the allocated  and thus proper  measures should … launchesits own malicious service instance or   instance into the  System … ",16,https://ieeexplore.ieee.org/abstract/document/8301700/,", A Bardhan, K Gupta, P Saha… - 2018 IEEE 8th …, 2018 - ieeexplore.ieee.org","computing cloud security VM ""rollback"" attack virtual machine IaaS challenges & solutions-A survey",2018.0
371,"… will cover Python-based offensive  tools and learn to automate your  tasks … 14,Creating and Managing VMWare  , explains how to automate  creation ona … that OpenStack was very popular in creating private  when it came to private  … ",Alle 2 versiesIn bibliotheek zoeken,https://books.google.nl/books?hl=nl&lr=&id=vJBiDwAAQBAJ&oi=fnd&pg=PP1&dq=cloud+security+VM+%22rollback%22+attack+virtual+machine+IaaS&ots=Bn_23U0IW7&sig=6-ii3AUaWSMqw2to7tgOTuCAFqk,B Aly - 2018 - books.google.com,"Hands-On Enterprise Automation with Python: Automate common administrative and cloud security VM ""rollback"" attack virtual machine IaaS tasks with Python",2018.0
8,"… First, in VMM [13] (hypervisor) where  provider is the first responsible on maintaining the …Network Virtualization is another  challenge in the virtualization since most  monitorsuse … to its related  by devoted physical channels remains the most  way to … ",3,https://www.sciencedirect.com/science/article/pii/S1877050918311451,"A Ahmed, T Zakariae - Procedia computer science, 2018 - Elsevier","Model cloud security VM ""rollback"" attack virtual machine IaaS Issues on Behalf cloud security VM ""rollback"" attack virtual machine IaaS Provider and User cloud security VM ""rollback"" attack virtual machine IaaS Behaviors",2018.0
196,"… and software stack of both parties involved in the data transmission through the commodity hardware [20 …  introspection via online kernel data redirection,” in 2012 IEEE Symposiumon  and Privacy … [8] NIST Information Technology Laboratory, “NIST  … ",1,https://ieeexplore.ieee.org/abstract/document/8500169/,",  - 2018 IEEE International Conference on Electro …, 2018 - ieeexplore.ieee.org","Fast tamper detection for hierarchical data in live cloud security VM ""rollback"" attack virtual machine IaaS forensics",2018.0
6,"… 5, Laniepce, 2013, Engineering Intrusion Prevention Services for  : The Wayof the Hypervisor, Proposed a hypervisor-based monitoring approach. Most promising,improves user  . Depends on the trust of  provider … ",34,https://www.sciencedirect.com/science/article/pii/S0045790617320724,"N Subramanian, A Jeyaraj - Computers & Electrical Engineering, 2018 - Elsevier","Recent cloud security VM ""rollback"" attack virtual machine IaaS challenges in cloud security VM ""rollback"" attack virtual machine IaaS computing",2018.0
391,"… H., Zhu, X., Qiu, D., Liu, L., and Du, Z., Scheduling for Workflows with -SensitiveIntermediate Data by Selective Tasks Duplication in ; TPDS Sept … Jia, W., and Zhao, W.,PLAN: Joint Policy- and Network-Aware  Management for  Data Centers … ",Alle 5 versies,https://ieeexplore.ieee.org/abstract/document/8172510/,"MA Abd El Ghany, I Abdelaziz… - … on Parallel and …, 2018 - ieeexplore.ieee.org",2017 Index IEEE Transactions on Parallel and Distributed Systems Vol. 28,2018.0
393,"… the typical network management functions (Fault, Configuration, Accounting, Performance and‐FCAPS) requested … on the network can be defined, facilitating straightforward operations if … oriented description language to describe a topology of -based web … ",1,https://books.google.nl/books?hl=nl&lr=&id=QFxTDwAAQBAJ&oi=fnd&pg=PA227&dq=cloud+security+VM+%22rollback%22+attack+virtual+machine+IaaS&ots=7EUoHHJjGq&sig=2UagA4oKfE7NxHMI5QWBtl4_fY4,"LM Contreras, V López, … - 5G System Design …, 2018 - books.google.com",Network management and orchestration,2018.0
394,"… to follow in AWS Lambda to make your application resilient and  according to … Instead ofone dedicated  per application, multiple containers can run on a single … ECS), ElasticKubernetes Service (EKS), and AWS Fargate, followed by Docker , CloudFoundry, and … ",1,https://books.google.nl/books?hl=nl&lr=&id=cB9sDwAAQBAJ&oi=fnd&pg=PP1&dq=cloud+security+VM+%22rollback%22+attack+virtual+machine+IaaS&ots=OVpiPw5nA8&sig=JizLCZmPCSMLPb7THccatG-wpcU,M Labouardy - 2018 - books.google.com,"Hands-On Serverless Applications with Go: Build real-world, production-ready applications with AWS Lambda",2018.0
39,"… In terms of elastic , today's  environment require concrete firewallsthat provide network  protection at the edge of private  andexceptionally scalable north-south data centre firewall … ",4,http://eprints.covenantuniversity.edu.ng/11314/,", , S Misra - 2018 - eprints.covenantuniversity.edu.ng","computing cloud security VM ""rollback"" attack virtual machine IaaS : Issues and developments",2018.0
50,… Fig. 1 -  flow Fig. 2 mainly describe about the  how it can open the backdoor in thehyervisors to compromised the integrity of the data and  of hypervisors … which allowthe engine to analysis the malware to make system more . Fig … ,1,https://papers.ssrn.com/sol3/papers.cfm?abstract_id=3170188,"H Dhote,  - … of 3rd International Conference on Internet …, 2018 - papers.ssrn.com",Practice on Detecting Malware in Virtualized Environment of ,2018.0
53,"… In fact, the hypervisor is an important cornerstone of  computing that is not … of the integrityand compliance of the employee's mobile device to the desired  policies. virtualization mechanisms based on a trusted transparent monitoring hypervisor would help … ",1,https://link.springer.com/chapter/10.1007/978-3-030-04834-1_9,",  - From Database to Cyber , 2018 - Springer","Virtualization Technologies and cloud security VM ""rollback"" attack virtual machine IaaS : advantages, issues, and perspectives",2018.0
323,…  can provide an abstraction or virtualization layer between the application and the … 126Self-healing infrastructures Core tenets Service-oriented architectures and microservices-native toolkit … projects Summary 136 139 Chapter 6:  and Reliable  in a … ,3,https://books.google.nl/books?hl=nl&lr=&id=QshsDwAAQBAJ&oi=fnd&pg=PP1&dq=cloud+security+VM+%22rollback%22+attack+virtual+machine+IaaS&ots=qDeTnlBDFC&sig=T6WQHzTQsMAYqEEPmsv55pWr3Ew,"T Laszewski, K Arora, E Farr, P Zonooz - 2018 - books.google.com",Native Architectures: Design high-availability and cost-effective applications for the ,2018.0
