,abstract,citations,link,reference,title,year
225,"… paths accessed by popular applications in everyday use contain significantly fewer  bugsthan … Our measurements from three production   show that for the  with same …Considering the low network utilization in -scale datacenters, we address this by … ",6,https://www.usenix.org/conference/atc17/technical-sessions/,"PA Misra, Y Zhang, , N Froyd, Z Zhang… - 2017 {USENIX} Annual …, 2017 - usenix.org",Scaling distributed file systems in resource-harvesting datacenters,2017.0
91,"… challenges,” Inf. Sci. (Ny)., vol. 305, pp. 357–383, 2015. [27] B. Hay, K. Nance, andM. Bishop, “Storm  rising:  challenges for   computing,” Proc.Annu. Hawaii Int. Conf. Syst. Sci., pp. 1–7, 2011. [28] DAB … ",5,https://ieeexplore.ieee.org/abstract/document/8181502/,", JA Van Der Poll - 2017 IEEE 3rd International …, 2017 - ieeexplore.ieee.org","failure trends of cloud security VM ""rollback"" attack virtual machine IaaS computing",2017.0
288,… 297 Development life-cycle models 297  DevOps 300 Version control and changemanagement 302 Provisioning and deprovisioning 303  coding techniques 303 Codequality and testing 306 …  VDI/VDE  access  broker  as a … ,15,https://books.google.nl/books?hl=nl&lr=&id=NaJBDwAAQBAJ&oi=fnd&pg=PP1&dq=cloud+security+VM+%22rollback%22+attack+virtual+machine+IaaS&ots=dLzaoTTjW1&sig=ckCC9tx3Hj9VUVV4Ig39W3rthIg,JM Stewart - 2017 - books.google.com,CompTIA Security+ Review Guide: Exam SY0-501,2017.0
162,"… or more networks, such as Private, Community, Public, or Hybrid  as described … provides identity verification for  consumers and tasks, as well as protection for … Workloadslayer 66 provides examples of functionality for which the  computing environment … ",7,https://patents.google.com/patent/US9563777B2/en,"Y Deng, R Mahindru, … - US Patent …, 2017 - Google Patents",policy generation based on snapshots of similar ,2017.0
146,"… 3) Services Isolation Isolating services without sharing kernel is absolute requirement on public … service isolation and it should be the preferred mechanism for   computing …is as important to organizations as reliability, performance, and  when deciding … ",1,https://ieeexplore.ieee.org/abstract/document/8101597/,"AH Al-Sharidah, HA Al-Essa - 2017 9th Computer Science and …, 2017 - ieeexplore.ieee.org","Toward cost effective and optimal selection of IT disaster recovery cloud security VM ""rollback"" attack virtual machine IaaS solution",2017.0
22,"…  providers have to de- crypt the data to get the actual data in order to process it, whichraises the privacy concerns in the . Many encryption methods are based on the applicationof fully homomorphic encryption to provide in the  of  … ",8,https://www.igi-global.com/chapter/cloud-security-issues-and-challenges/171349,",  - Resource Management and Efficiency in  …, 2017 - igi-global.com",issues and challenges,2017.0
14,… more  deployment models in which  resources are bound together by different  …SaaS -API  -Semantic Access Control Policy Language -CloudProtect -Internetware … iscarried out by gaining unauthorized access to a high-performance  server with … ,3,http://www.ijeter.everscience.org/Manuscripts/Volume-5/Issue-12/Vol-5-issue-12-M-17.pdf,"AI Wani,  - International Journal of Emerging …, 2017 - ijeter.everscience.org","A Survey of cloud security VM ""rollback"" attack virtual machine IaaS issues and cloud security VM ""rollback"" attack virtual machine IaaS in cloud security VM ""rollback"" attack virtual machine IaaS and their possible defenses",2017.0
12,… Hardware based mechanism is discussed in Jin et al. [82] to  guest  beneath unreliable hypervisor … This approach decreases the complexity and provides against various physical intrusions in  datacenter. 3.2.5 scheduling  … ,4,https://content.iospress.com/articles/multiagent-and-grid-systems/mgs262,"DJ Prathyusha, S Naseera - Multiagent and Grid Systems, 2017 - content.iospress.com","A study on cloud security VM ""rollback"" attack virtual machine IaaS issues",2017.0
179,"… Towards an efficient snapshot approach for   in  … access to a reliable andshared computing and storage resources [16], [5]. In a , the virtualization … the guest OS usingthe VMI technique when capturing a snapshot, which reduces the  state snapshot … ",4,https://www.sciencedirect.com/science/article/pii/S0020025516305771,", , J Zheng, H Liu, , J Huai - Information Sciences, 2017 - Elsevier","Towards an efficient snapshot approach for cloud security VM ""rollback"" attack virtual machine IaaS in ",2017.0
81,"… It provides flexibility to the  user by avoiding data loss. However, it brings back thevulnerability in that , which is addressed earlier. It enables the previously disabled credentials and reverts the  to old configuration errors and  policies … ",35,https://link.springer.com/article/10.1007/s11227-016-1805-9,", K Acha - the Journal of Supercomputing, 2017 - Springer","Virtualization layer cloud security VM ""rollback"" attack virtual machine IaaS challenges and intrusion detection/prevention systems in cloud security VM ""rollback"" attack virtual machine IaaS computing: a comprehensive review",2017.0
115,"… Data integrity in the  is a well-researched property within data  … Examples of suchsystems include HAIL and Dep- Sky, which uses the -of- principle. Our solution,TrustStore, addresses some of these challenges (see the sidebar for details) … ",22,https://ieeexplore.ieee.org/abstract/document/7465693/,", , L Zhu - IEEE Internet Computing, 2016 - ieeexplore.ieee.org","Developing dependable and cloud security VM ""rollback"" attack virtual machine IaaS applications",2016.0
103,"… keep track of the patch level and latest patches applied on each  which is very importantespecially for  updates … some  may be dormant at the distribution of patches time,that makes it important to check every  at startup … 1.  Admission Control Framework … ",2,https://ieeexplore.ieee.org/abstract/document/7821972/,"O AbdElRahem, … - 2016 11th International …, 2016 - ieeexplore.ieee.org","A framework for cloud security VM ""rollback"" attack virtual machine IaaS admission control in cloud security VM ""rollback"" attack virtual machine IaaS environment",2016.0
13,"… To   before launching user can employ the techniques such as HyperSafe, TCCP(Trusted  Computing Platforms … TID4 VID41, VID52  flaws in most  monitorsProper monitoring of  and filtering of illegal and legal users from the  … ",15,https://www.igi-global.com/article/analyzing-virtualization-vulnerabilities-and-design-a-secure-cloud-environment-to-prevent-from-xss-attack/144185,"N Nagar,  - International Journal of Applications and …, 2016 - igi-global.com","Analyzing virtualization vulnerabilities and design a cloud security VM ""rollback"" attack virtual machine IaaS environment to prevent from XSS ",2016.0
9,"… Replus also adopts an instruction-level updating mechanism, which is more efficient for specific patches … TEE: a  DRTM based execution environment for   … IEEE TransDepend  Comput (TDSC), 2012, 9: 838–851 4 Shi L, Zou DQ, Jin H. Xen … ",9,http://scis.scichina.com/en/2016/050105.pdf,", , D Zou - Science China Information Sciences, 2016 - scis.scichina.com",Theory and methodology of research on ,2016.0
172,"…  storage can provide high fault-tolerance through redundancy and -recovery through …data storage needs to be of a higher volume, more dependable, , and have …  grants anti-virus, spam mail filtering, threat detection and , and privacy … ",46,https://www.sciencedirect.com/science/article/pii/S1364032116000629,", X Yin, Y Tan, , Y Gao, Y Cao, J Li - Renewable and Sustainable …, 2016 - Elsevier","The contributions of cloud security VM ""rollback"" attack virtual machine IaaS technologies to smart grid",2016.0
10,"… Software level  difficult, with excessively overhead in the "" … Containers allowdata-centre and  admin's to run double to triple epochs periods extra servertasks/instances//jobs/processes on a precise server … NAMESPACES OFFER ISOLATION AND … ",18,https://ieeexplore.ieee.org/abstract/document/7530284/,", JK Patel, S Akhtar… - … conference on circuit …, 2016 - ieeexplore.ieee.org","A study, analysis and deep dive on cloud security VM ""rollback"" attack virtual machine IaaS PAAS cloud security VM ""rollback"" attack virtual machine IaaS in terms of Docker container ",2016.0
82,"… environment, it was informed that in addition to the   resource usage, to monitoringsystem status, as well as third-party tools provide a  interface available to … None of the abovesystems could be used to test and examine the  of  platforms … ",3,https://ieeexplore.ieee.org/abstract/document/7545896/,"Z Wang, J Zeng, T Lv, B Shi,  - … on Cyber and  …, 2016 - ieeexplore.ieee.org","Cloudauditor: A cloud security VM ""rollback"" attack virtual machine IaaS auditing framework based on nested virtualization",2016.0
158,"… more types of , such as private, community, and/or public , which remain … layer 402includes the hardware and software components of the  computing environment … functions,such as, for example, resource provisioning, metering and pricing,  and user … ",18,https://patents.google.com/patent/US9355256B2/en,"SN Chari,  - US Patent 9,355,256, 2016 - Google Patents","Sanitization of cloud security VM ""rollback"" attack virtual machine IaaS images",2016.0
123,"… were launched as the first open-source computing toolkits for managing , 2008 … of computingresources can offer significant advances in the following aspects: , reliability, compatibility …case, the virtualization should be used to guarantee to each  subscriber a … ",66,https://www.sciencedirect.com/science/article/pii/S108480451500288X,",  - Journal of Network and Computer Applications, 2016 - Elsevier","Review and analysis of networking challenges in cloud security VM ""rollback"" attack virtual machine IaaS computing",2016.0
16,"… So, after identifying the threats and vulnerabilities there are various ways to  the  … Theencryption methods and various devices are being used for the  like firewalls and intrusiondetection systems which can further protect the  system. Page 7 … ",2,https://www.academia.edu/download/46484247/v4i516.pdf,"D Nagpal,  - International journal of research in computer …, 2016 - academia.edu","Survey on threats cloud security VM ""rollback"" attack virtual machine IaaS and implementation of cloud security VM ""rollback"" attack virtual machine IaaS in cloud security VM ""rollback"" attack virtual machine IaaS infrastructure",2016.0
4,"…  federation, Multi-, Utility computing, Inter-, cross-, 2014 …  providersuse hypervisor and  technologies in  multi-tenant environment which consists of … Hence,the “client to client ” is a major  risk to the virtualized environment … ",95,https://www.sciencedirect.com/science/article/pii/S1084804516301771,", , B Dhaghighi, … - Journal of Network and …, 2016 - Elsevier","On cloud security VM ""rollback"" attack virtual machine IaaS : A taxonomy and intrusion detection and prevention as a service",2016.0
56,"… Zhaolong et al. (2016) discussed recent developments in  computing, various  issuesand challenges in  computing environment, various … (2013) provided a systematic reviewof  issues in  based on an attribute-driven methodology … ",200,https://www.sciencedirect.com/science/article/pii/S1084804516301990,", ,  - Journal of Network and Computer …, 2016 - Elsevier","A survey on cloud security VM ""rollback"" attack virtual machine IaaS computing cloud security VM ""rollback"" attack virtual machine IaaS : Issues, threats, and solutions",2016.0
15,"… Soh, and J. a. Thom, “ computing : From single to multi-,” Proc … Santhi Thilagam,“Heuristics based server consolidation with residual resource defragmentation in  datacenters … Wei, X. Zhang, G. Ammons, V. Bala, and P. Ning, “Managing  of  … ",5,https://ieeexplore.ieee.org/abstract/document/7796151/,", , … - … on smart  …, 2016 - ieeexplore.ieee.org","A framework to cloud security VM ""rollback"" attack virtual machine IaaS the cloud security VM ""rollback"" attack virtual machine IaaS image in cloud security VM ""rollback"" attack virtual machine IaaS computing",2016.0
45,"… to the presence of multi-tenants in a  environment, resources (ie, servers, , storage)are … These  vulnerabilities represent some of the most significant obstacles to the adoptionof … data to , administrators need to ensure that all data in  are completely … ",38,https://www.researchgate.net/profile/Tariqul_Islam16/publication/308172311_A_Classification_and_Characterization_of_Security_Threats_in_Cloud_Computing/links/57dc38cf08aeea195935c51f/A-Classification-and-Characterization-of-Security-Threats-in-Cloud-Computing.pdf,", , S Zeadally - Int. J. Next-Gener. Comput, 2016 - researchgate.net","A classification and characterization of cloud security VM ""rollback"" attack virtual machine IaaS threats in cloud security VM ""rollback"" attack virtual machine IaaS computing",2016.0
44,"… storage. In [55], Bessani et al. proposed Depsky which uses many  to builda -of- to address two  requirements in their storage system,which are confidentiality and availability of data. They … ",82,https://pdfs.semanticscholar.org/09fd/5326be429b39d75103ddd6550176c10e0ba3.pdf,"S Aldossary,  - International Journal of …, 2016 - pdfs.semanticscholar.org","Data cloud security VM ""rollback"" attack virtual machine IaaS , privacy, availability and integrity in cloud security VM ""rollback"" attack virtual machine IaaS computing: issues and current solutions",2016.0
7,"… For protecting  against stepping-stone , a  introspection based mechanism isprovided in … guest operating system thus results in exposing the newly created  to threats … An approach of stealing private information on the  due to sharing of physical … ",132,https://www.sciencedirect.com/science/article/pii/S1084804516301060,"MA Khan - Journal of network and computer applications, 2016 - Elsevier","A survey of cloud security VM ""rollback"" attack virtual machine IaaS issues for cloud security VM ""rollback"" attack virtual machine IaaS computing",2016.0
134,… to design an access control architecture that provides a great level of collaboration within andacross these multiple  … The  issues caused by the malware-injection  includeuser data leakage and unauthorized access to the resources of the  [18 … ,2,https://pdfs.semanticscholar.org/749b/04d088f0600a040c45f533b02b633c45fe91.pdf,", J Mitchell - Services Transactions on  …, 2016 - pdfs.semanticscholar.org","A new access control scheme for protecting distributed cloud security VM ""rollback"" attack virtual machine IaaS services and resources",2016.0
106,"… As it was observed in “ outages” section,  outages can occur due to themisconfiguration of management services …  is also an essential aspect for HA ;however, none of the presented solutions deals with  mechanisms, such as those … ",47,https://link.springer.com/article/10.1186/s13677-016-0066-8,", , , … - Journal of  …, 2016 - Springer","High availability in cloud security VM ""rollback"" attack virtual machine IaaS : systematic review and research challenges",2016.0
258,… Hand-Cranked  Hybrid and Mixed  Options Bare-Metal  Deciding on a … TheChange Pipeline as a Vulnerability 302 Managing  Risks with  Accounts … virtualizingour production servers and experimenting with Amazon's new  hosting service … ,104,https://books.google.nl/books?hl=nl&lr=&id=BIhRDAAAQBAJ&oi=fnd&pg=PR2&dq=cloud+security+VM+%22rollback%22+attack+virtual+machine+IaaS&ots=yWaoa-XFWk&sig=ee7eHqruz-Cbe9zI-TXOMlyNcF8,K Morris - 2016 - books.google.com,Infrastructure as code: managing servers in the ,2016.0
19,"…   offer additional resources such as a - disk image library, raw blockstorage … A fixed bug can introduce another  hole in the application [ 18 … To prevent from such , intrusion detection system (IDS)/intrusion prevention system (IPS) can … ",6,https://link.springer.com/chapter/10.1007/978-81-322-2674-1_17,"K Kanagasabapathi, S Deepak,  - Proceedings of the …, 2016 - Springer","A study on cloud security VM ""rollback"" attack virtual machine IaaS issues in cloud security VM ""rollback"" attack virtual machine IaaS computing",2016.0
307,… As we discussed before; IGOD determines the location of a DC and it can also be consideredas an independent tool working towards  and privacy of data … federated  setting(a federated  can incorporate several public/private ). 1.3 Organization … ,1,https://mospace.umsystem.edu/xmlui/handle/10355/50815, - 2016 - mospace.umsystem.edu,"DBHAaaS–Database High Availability As A Service For cloud security VM ""rollback"" attack virtual machine IaaS Computing",2016.0
321,"… API Application programming interface ATM Automated teller  BIOS Basic Input/OutputSystem BYOC Bring Your Own  BYOD Bring … No  system is invulnerable … SpringerInternational Publishing Switzerland 2016 E. Diehl, Ten Laws for , DOI 10.1007 … ",5,https://link.springer.com/content/pdf/10.1007/978-3-319-42641-9.pdf,E Diehl - 2016 - Springer,Ten Laws for ,2016.0
231,"… data processing system 200 may be implemented in a distributed  computing environment …of the Open Visualization Format (OVF), which defines an open, , portable, and … may be, for example, passwords, credit card numbers, social  numbers, bank … ",1,https://patents.google.com/patent/US9355257B2/en,"SN Chari,  - US Patent 9,355,257, 2016 - Google Patents","Sanitization of cloud security VM ""rollback"" attack virtual machine IaaS images",2016.0
217,"… VI. CONCLUSION With the modern evolution of container , there is a desperate need for … S. Parsons, “Playing hide-and-seek: an abstract game for cyber ,” in Proceedings …22] ——, “Anomaly detection for ephemeral    ,” in Network … ",7,https://ieeexplore.ieee.org/abstract/document/7809699/,", , … - 2016 IEEE 2nd …, 2016 - ieeexplore.ieee.org",Smart moving target defense for linux container resiliency,2016.0
380,… National  Agency NSCC . . . . Network  for  Computing OpenLDAP OpenLightweight Directory Access Protocol P2P … SSL . . . . .  Sockets Layer SSO … TLS . . . . .Transport Layer  TME . . . . . Tempo Médio de Execução TMR … ,1,http://www.teses.usp.br/teses/disponiveis/55/55134/tde-28032016-144543/en.php, - 2016 - teses.usp.br,Modelos de negócio para ambientes de computação em nuvem que consideram atributos de qos relacionados a desempenho ea segurança,2016.0
263,"… Interoperability and migration over multiple- … components for confidentiality, developersneed to provide mechanisms in the application to ensure the  of sensitive … For example,Girish and Guruprasad (2014) focuses on six data frameworks for the  migration … ",54,https://www.sciencedirect.com/science/article/pii/S0164121216300966,"MF Gholami, , … - Journal of Systems and …, 2016 - Elsevier","migration process—A survey, evaluation framework, and open challenges",2016.0
194,"… on the services, but also significant savings on the cost of maintaining the  of such … casesrunning on public networks, that is, in the type of networks used for public  … The data-centerof a  service provider provides , PaaS and SaaS among other services … ",19,https://patents.google.com/patent/US9300633B2/en,", KA Beaty, , VK Naik - US Patent 9,300,633, 2016 - Google Patents",Network-level access control management for the ,2016.0
222,"… specific systems/services such as HPC sys- tems [131, 147, 153],   [125], data … Dataset:We chose 32 popular  services as listed in Table 1. We … CROSS, HARDWARE, HUMAN,LOAD, NATDIS, NET- WORK, POWER, STORAGE, , SERVER, UPGRADE … ",86,https://dl.acm.org/doi/abs/10.1145/2987550.2987583,", , , … - … Symposium on  …, 2016 - dl.acm.org","Why does the cloud security VM ""rollback"" attack virtual machine IaaS stop computing? Lessons from hundreds of service outages",2016.0
287,US9450836B2 - System and method for management of network-based services - GooglePatents. System and method for management of network-based services. DownloadPDF Info. Publication number US9450836B2. US9450836B2 … ,65,https://patents.google.com/patent/US9450836B2/en,"…, A Dalela, MJ Morrow, Tomsu - US Patent 9,450,836, 2016 - Google Patents",System and method for management of network-based services,2016.0
227,"… Logical switching and distributed logical routing help achieve this for the mobile  in a veryefficient … Micro-segmentation, a very granular level of  using isolation based on thezero-trust principle, can be applied at the  level to tightly  the environment … ",6,https://ieeexplore.ieee.org/abstract/document/7474409/,"D Rajan - … 4th IEEE International Conference on Mobile  …, 2016 - ieeexplore.ieee.org",Common platform architecture for network function virtualization deployments,2016.0
325,"… SQO Single-Query Optimization    xv Page 16. Chapter 1 Introduction … In thesecond part, this chapter also discusses  computing and system architectures based onmultiple . Finally, it concludes with a examination of container-based virtu … ",6,https://ir.lib.uwo.ca/etd/4016/, - 2016 - ir.lib.uwo.ca,"Complex event processing as a service in multi-cloud security VM ""rollback"" attack virtual machine IaaS environments",2016.0
192,"… Scientific. Bonvin et al. (2010), Reactive,  Replication, System Availability, Resource Utilization,, Liu et al. (2009 … Clusters, Web. AlZain et al. (2012), Reactive, Replication, System ,Resource Utilization, Multi-. Yu et al. (2015), Reactive … ",70,https://www.sciencedirect.com/science/article/pii/S1084804516301746,", , ,  - Journal of Network and Computer …, 2016 - Elsevier","Reliability and energy efficiency in cloud security VM ""rollback"" attack virtual machine IaaS computing systems: Survey and taxonomy",2016.0
284,"… communication is done via the Internet, implying higher cost, and lower  and quality …spectrum of information available, multilayer correlated faults of both the  user and … Private do not have such problems because of available observability and controllability in … ",5,https://content.taylorfrancis.com/books/e/download?dac=C2015-0-60918-2&isbn=9781498742481&doi=10.1201/9781315369105-24&format=pdf,"L Gönczy, , S Bozóki… - Trustworthy Cyber …, 2016 - content.taylorfrancis.com","MDD-based design, configuration, and monitoring of resilient cyber-physical systems",2016.0
199,"… for  Computing Environments”, IJCSNS International Journal of Computer Science andNetwork , Vol 13 … IDSaaS: Intrusion Detection System as a Service in Public . In12th IEEE/ACM International Symposium on Cluster,  and Grid Co mputing, pp 685 … ",7,https://ieeexplore.ieee.org/abstract/document/7394269/,"Y Rebahi, S Hohberg, L Shi, BM Parreira… - 2015 International …, 2015 - ieeexplore.ieee.org",appliances: the next generation ,2015.0
331,"…  Recovering from  Restoration The Restoration Manager recovers a consis- tentstate from an inconsistent one. Greenability … [2] M. Armbrust, A. Fox, R. Griffith, AD Joseph, at al.,Above the : A Berkeley View of  Computing, UCB/EECS-2009 … ",8,https://ieeexplore.ieee.org/abstract/document/7214126/,",  - … 8th International Conference on  …, 2015 - ieeexplore.ieee.org","Quality-driven architectural patterns for self-aware cloud security VM ""rollback"" attack virtual machine IaaS -based software",2015.0
161,… References.....202 CHAPTER 10  migration to … Performance.....212 5 Scenarios.....214 xi … art Approaches Tackling  .....464 3.1 … ,15,https://books.google.nl/books?hl=nl&lr=&id=meycBAAAQBAJ&oi=fnd&pg=PP1&dq=cloud+security+VM+%22rollback%22+attack+virtual+machine+IaaS&ots=E7buH4aLLq&sig=C8mrdZyYZfpYDJvaMFsPx-47lX4,",  - 2015 - books.google.com","The cloud security VM ""rollback"" attack virtual machine IaaS ecosystem: technical, legal, business and management issues",2015.0
138,"… Lack of trust narrows down the potential high usage of the  … are being continuously detectedlike; Theft-of-Service , Denial of Service (DoS) ,  malware injection … Hence, whatneeded is that the service providers should be aware of  problems; they … ",11,https://link.springer.com/article/10.1007/s11277-015-2729-z,", MMZE Mohammed - wireless personal communications, 2015 - Springer","Building Customer trust in cloud security VM ""rollback"" attack virtual machine IaaS computing with an ICT-enabled global regulatory body",2015.0
11,"…  providers must undertake a substantial effort to  their systems in order to minimizethese threats that result from creation, communication, monitoring, modification, and … In a sharedenvironment, the  strength of the  equals the  strength of its … ",6,https://pdfs.semanticscholar.org/d765/432eaf890f1e9d3f9cf621cc08474e4e8a74.pdf,"VK Veeramachaneni - Int. J. Eng. Sci. Innov. Technol, 2015 - pdfs.semanticscholar.org","Issues and Countermeasures in cloud security VM ""rollback"" attack virtual machine IaaS Computing Environment",2015.0
