,abstract,citations,link,reference,title,year
316,"… gear are co-lo- cated because of their common environmental requirements and physical needs, and … Such public  do run many small applications, like a regular data center … cansupport both large online internal services as well as large public  offerings, with … ",27,https://www.morganclaypool.com/doi/abs/10.2200/S00874ED3V01Y201809CAC046,", … - Synthesis Lectures on …, 2018 - morganclaypool.com",The datacenter as a computer: Designing warehouse-scale ,2018.0
336,"… introducing mobile  computing. For  service providers, mobile  enable … offloadingis one of the common approaches for outsourcing mobile tasks to  vir- tual  ()based resources, while remote procedure calling is more suitable for … ",2,https://minerva-access.unimelb.edu.au/handle/11343/214041, - 2018 - minerva-access.unimelb.edu.au,Code Offloading and Resource Management Algorithms for Heterogeneous Mobile ,2018.0
374,"… Data Center Concepts New Application Types Automation, Orchestration, and  End-to …Modular Spine Integration Planning and Considerations  Considerations Phased ACIMigration Network … System Tab Tenants Tab Fabric Tab  Networking Tab L4-L7 Services … ",Alle 2 versiesIn bibliotheek zoeken,https://books.google.nl/books?hl=nl&lr=&id=qppLDwAAQBAJ&oi=fnd&pg=PT36&dq=cloud+security+VM+%22rollback%22+attack+virtual+machine+IaaS&ots=guxjzaqUoR&sig=rRJcXIqDpepU2fGlxwls1FLetRk,"F Dagenhardt, J Moreno, B Dufresne - 2018 - books.google.com","Deploying ACI: The complete guide to planning, configuring, and managing Application Centric Infrastructure",2018.0
397,… 18 Containers Are the New   … TABLE OF CONTENTSChapter 7:  in SQL Server      317 … ,2,https://books.google.nl/books?hl=nl&lr=&id=ADR1DwAAQBAJ&oi=fnd&pg=PR5&dq=cloud+security+VM+%22rollback%22+attack+virtual+machine+IaaS&ots=8tBwIP5LTC&sig=mzUJnD34o8JzT_HGf35k-Uom58s,B Ward - 2018 - books.google.com,Pro SQL Server on Linux: Including Container-Based Deployment with Docker and Kubernetes,2018.0
234,"… types of services, how to characterize workloads, customers' expectations, management of , issues, problems … 217 14.3 Project 3: Enhance  of Your AWS Instance … Nareshhas taught a  Computing class at Santa Clara University, where he also … ",14,https://link.springer.com/content/pdf/10.1007/978-3-319-77839-6.pdf,", Bhatt - 2018 - Springer",Computing,2018.0
145,"… FOR SUCCESSFUL  We introduce a Markov process to describe a   modeland … An attacker exploits various vulnerabilities to arrive at a  threat state and eventually …with visible and quantifiable states and construct 3 states, namely the  state (S … ",1,https://ieeexplore.ieee.org/abstract/document/8615386/,",  - 2018 28th International Telecommunication …, 2018 - ieeexplore.ieee.org",threat probability computation using markov chain and common vulnerability scoring system,2018.0
213,… claims description 3; 241001414834 Ephemeroptera Species 0 description 57; 239000008264 Substances 0 … The traditional defensive  strategy for distributed systems is tosafeguard against … monitoring may occur at the hypervisor level of the  software which … ,Alle 3 versiesIn cache,https://patents.google.com/patent/US20180332073A1/en,"N Ahmed - US Patent App. 15/812,093, 2018 - Google Patents",Moving Target Defense for Distributed Systems,2018.0
314,"… data processing system 200 may be implemented in a distributed  computing environment …of the Open Visualization Format (OVF), which defines an open, , portable, and … may be, for example, passwords, credit card numbers, social  numbers, bank … ",1,https://patents.google.com/patent/US9881167B2/en,"SN Chari,  - US Patent 9,881,167, 2018 - Google Patents","Sanitization of vitual cloud security VM ""rollback"" attack virtual machine IaaS images",2018.0
200,… low. These values represent educated guesses over a wide range of common deployments and do not have a precise semantics … EDIT) < 7 Table V shows the impactof threats (ti) in non- configured public . From … ,7,https://ieeexplore.ieee.org/abstract/document/8291578/,"H Abrar, , , … - IEEE …, 2018 - ieeexplore.ieee.org","Risk analysis of cloud security VM ""rollback"" attack virtual machine IaaS sourcing in healthcare and public health industry",2018.0
186,"… Public  are most suitable in scenarios where organizations wish to use collaborationservices like … of resources to fulfill the personal, granular, and specific requirements using-as-a … Reactive fault tolerance approaches have been explored for  as well as other … ",13,https://www.sciencedirect.com/science/article/pii/S1319157818306438,"P Kumari,  - Journal of King Saud University-Computer and …, 2018 - Elsevier","A survey of fault tolerance in cloud security VM ""rollback"" attack virtual machine IaaS computing",2018.0
98,"… are Theft-of-Service, DoS, Cross- Side Channel, Phishing, Malware Injection, Botnets and  . VIII … Design and Analysis of an Effective   System at QassimUniversity. International Journal of Computer Science and Information  (IJCSIS) … ",1,https://pdfs.semanticscholar.org/6093/a0427709b08412942c1b8467bf32b94d03c6.pdf,"SU Patel, SDN Padhiar - 2018 - pdfs.semanticscholar.org","Opportunities and challenges in cloud security VM ""rollback"" attack virtual machine IaaS -Based E-Learning",2018.0
185,"… an increasing demand for software services especially in Infrastructure- as-a-Service () ,where computers … When the  application developers build the public binary, the CAFE libraryis … is a set of code and data that composes the -sensitive functionalities … ",2,https://ieeexplore.ieee.org/abstract/document/8322174/,"S Park, , , JJ Won… - … and Computing, 2018 - ieeexplore.ieee.org","CAFE: A Virtualization-Based Approach to Protecting Sensitive cloud security VM ""rollback"" attack virtual machine IaaS Application Logic Confidentiality",2018.0
207,"… for teaching various courses (eg, systems configuration, routing mechanisms, and network ) in order … They can be placed within the same  or among different  in order …That is,  servers can be virtualized by these types like other computer networks … ",1,https://www.igi-global.com/chapter/applications-of-virtualization-technology-in-grid-systems-and-cloud-servers/188121," - … and Use of Virtualization Technology in  …, 2018 - igi-global.com","Applications of virtualization technology in grid systems and cloud security VM ""rollback"" attack virtual machine IaaS servers",2018.0
209,"… These solutions also face some challenges, such as , service level, data …  distinguishbetween technology and implementation, hence come with infrastructure, platform and … saves organizations from maintaining large infrastructure, which they are unlikely to … ",6,https://www.sciencedirect.com/science/article/pii/S1084804517303764,", Y Khandelwal, BS Krishna,  - Journal of Network and …, 2018 - Elsevier","Analytics in/for cloud security VM ""rollback"" attack virtual machine IaaS -an interdependence: A review",2018.0
311,"… G06F12/1466—Key-lock mechanism; G06F12/1475—Key-lock mechanism in a  system,eg with … code may become a target of an  such as, for example,  by malware … memoryfor pages (typically 4096 bytes) as read-only for enforcement of  access rights … ",1,https://patents.google.com/patent/US9864629B2/en,"I Muttik, A Nayshtut, Y Bulygin, AA Furtak… - US Patent …, 2018 - Google Patents",Real-time code and data protection via CPU transactional memory suppport,2018.0
241,… information regarding the positive influences of a   environment and the effects of … :An  is associated with the harmful actions against resources in the  … Vulnerability: Avulnerability is a   architecture loophole with an inherent … ,1,http://search.proquest.com/openview/a82ee16598e593fd5213c1221bc85312/1?pq-origsite=gscholar&cbl=18750&diss=y,ML Lucas - 2018 - search.proquest.com,Exploring the strategies cybersecurity managers recommend for implementing or transitioning to the ,2018.0
224,"… Buffer overflow by executing in a restricted environment, eg sandbox or    …and subgroups addressing additional information or applications relating to  arrangementsfor … illustrating an example of abstraction layers of a  computing environment … ",2,https://patents.google.com/patent/US9881168B2/en,"SN Chari,  - US Patent 9,881,168, 2018 - Google Patents","Sanitization of cloud security VM ""rollback"" attack virtual machine IaaS images",2018.0
237,"… Also, important considerations such as system  (as governed by the organization's policy) needs to … structures must be updated continuously to cater for changing dynamics of a system … TABLE III: Advantages and disadvantages of FT methods in the  … ",21,https://ieeexplore.ieee.org/abstract/document/8318693/,"MA Mukwevho,  - IEEE Transactions on Services …, 2018 - ieeexplore.ieee.org","Toward a smart cloud security VM ""rollback"" attack virtual machine IaaS : A review of fault-tolerance methods in cloud security VM ""rollback"" attack virtual machine IaaS systems",2018.0
246,"… Juju includes providers for all major public , such as Amazon Web Services … our environments has brought in the additional operational complexity of  operational teams …mode includes the support for rolling updates, transport layer  encryption between … ",3,https://link.springer.com/chapter/10.1007/978-3-319-78637-7_9,",  - Software-Defined Centers, 2018 - Springer","Automated Multi-cloud security VM ""rollback"" attack virtual machine IaaS Operations and Container Orchestration",2018.0
216,"… Failures at this stage can have serious implications for  providers promising configurationsthat are not present, or in case of misconfigurations/ …  path verification permits toeven strengthen  checks, by verifying robustness of the ToC against … ",8,https://www.sciencedirect.com/science/article/pii/S0167404817302018,", , , … - … & , 2018 - Elsevier","Modeling time, probability, and configuration constraints for continuous cloud security VM ""rollback"" attack virtual machine IaaS service certification",2018.0
256,"… is the main challenge of realizing mobile  augmentation systems in terms of  … memorystacks, register states, and synthetic classes between  on  and mobile … of the mobileapplication using CLR, which harms the application's scalability in mobile  … ",26,https://dl.acm.org/doi/abs/10.1145/3152397,",  - ACM Computing Surveys (CSUR), 2018 - dl.acm.org","Augmentation techniques for mobile cloud security VM ""rollback"" attack virtual machine IaaS computing: A taxonomy, survey, and future directions",2018.0
233,"… Similarly, if the hard drive of a  at the  layer burns out, the operating system installedon the  at the PaaS layer will also crash … For example, a run-time exception at PaaS or a virus at SaaS. The general fault tolerance procedure in  environment is as follows … ",18,https://www.sciencedirect.com/science/article/pii/S0166361517304438,",  - Computers in Industry, 2018 - Elsevier","Fault tolerance in cloud security VM ""rollback"" attack virtual machine IaaS computing environment: A systematic survey",2018.0
262,Automated Enforcement of  Policies in  and Hybrid Infrastructure Environments.Download PDF Info … A1 US2018234459 A1 US 2018234459A1 Authority US United States Priorart keywords rule  infrastructure resources … 239000008264  Substances 0 … ,5,https://patents.google.com/patent/US20180234459A1/en,"LJ Kung, JRG Santos, SG Sikder - US Patent App. 15/878,386, 2018 - Google Patents","Automated Enforcement of cloud security VM ""rollback"" attack virtual machine IaaS Policies in cloud security VM ""rollback"" attack virtual machine IaaS and Hybrid Infrastructure Environments",2018.0
271,"… addresses: SS Gill and R. Buyya,  Computing and Distributed Systems ()Laboratory, School of …  is an ability of the computing system to protect the system from … Forefficient capacity planning,  workloads should be analyzed before execution to finish … ",17,https://dl.acm.org/doi/abs/10.1145/3241038,",  - ACM Computing Surveys (CSUR), 2018 - dl.acm.org","A taxonomy and future directions for sustainable cloud security VM ""rollback"" attack virtual machine IaaS computing: 360 degree view",2018.0
236,"… BlobCR: Efficient checkpoint-restart for HPC applications on   using  diskimage snapshots … International Journal of Computer Science and  (IJCSS), 3(6).[34] Rejinpaul, NR, & Visuwasam, LMM (2012) … for  applications … ",2,http://www.ijcee.org/vol10/964-T107.pdf,"M Alshayeji, , E Yossef,  - Int J Comput Electr Eng, 2018 - ijcee.org","A study on fault tolerance mechanisms in cloud security VM ""rollback"" attack virtual machine IaaS computing",2018.0
268,…  and the   Access  Brokers  Storage  as … User IssuesZero-Day Exploits Other Issues Embedded Systems  Application Vulnerabilities InputVulnerabilities Memory Vulnerabilities  Programming Programming … ,41,https://books.google.nl/books?hl=nl&lr=&id=MLg4DwAAQBAJ&oi=fnd&pg=PP1&dq=cloud+security+VM+%22rollback%22+attack+virtual+machine+IaaS&ots=mfdQK-OVF6&sig=_uqUQkAIsshVm-YYP2t8E6gvRXI,"E Dulaney,  - 2017 - books.google.com",CompTIA Security+ Study Guide: Exam SY0-501,2017.0
257,"… private . The main and most common attribute of hybrid  is elasticity and … fully solvedlike fault tolerance, effective scheduling of  resources , workflow scheduling, load balancing, etc … 2[35] Amazon  Image and Amazon Map  Environm ent … ",1,http://tudr.thapar.edu:8080/jspui/handle/10266/4689,",  - 2017 - tudr.thapar.edu",Proactive Fault Tolerance Technique for Scientific Applications in ,2017.0
254,"… Authority US United States Prior art keywords transaction compromised   plurality Priorart … H04L63/1416—Event detection, eg  signature detection. H—ELECTRICITY; H04 … specificmanagement and integration aspects; G06F2009/45587—Isolation or  of  … ",11,https://patents.google.com/patent/US9838415B2/en,"J Powers, SK Brueckner, KJ Thurber - US Patent 9,838,415, 2017 - Google Patents",Fight-through nodes for survivable computer network,2017.0
47,… 3 PROPOSED COLLABORATIVE AGENT BASED IDS FRAMEWORK FOR  Our proposed CIDS framework for … Securing  from ddos  using intrusion detectionsystem in   … Distributed intrusion detection in  using mobile agents … ,2,https://dl.acm.org/doi/abs/10.1145/3136825.3136905,"U Nagar, , ,  - … International Conference on of …, 2017 - dl.acm.org","A framework for data cloud security VM ""rollback"" attack virtual machine IaaS in cloud security VM ""rollback"" attack virtual machine IaaS using collaborative intrusion detection scheme",2017.0
122,Fight-through nodes with disposable   and  of persistent state … States Priorart keywords transaction computing system class   transactions Prior … 238000004891communication Methods 0 description 28; 239000008264  Substances 0 … ,13,https://patents.google.com/patent/US9769250B2/en,"J Powers, SK Brueckner, … - US Patent …, 2017 - Google Patents","Fight-through nodes with disposable cloud security VM ""rollback"" attack virtual machine IaaS and cloud security VM ""rollback"" attack virtual machine IaaS of persistent state",2017.0
25,"… We will review in network layer all methods, approaches and  tools used to the public net- work.  Computing represents all  threats in 307 Page 6. (a) in depth (b) Defense in depth Fig. 2:  and defense in depth … ",5,https://ieeexplore.ieee.org/abstract/document/8308301/,"M Bouchaala, , LA Saidane… - 2017 IEEE/ACS 14th …, 2017 - ieeexplore.ieee.org","End to end cloud security VM ""rollback"" attack virtual machine IaaS computing architecture based on a novel classification of cloud security VM ""rollback"" attack virtual machine IaaS issues",2017.0
265,"… CHAPTER 7—MANAGING WEB-BASED APPLICATIONS Internally hosted, -hosted, orsoftware … APPLICATION MANAGEMENT  Applications are at the heart of anorganization's  … decisions then lead to the creation of much more  applications and … ",3,https://books.google.nl/books?hl=nl&lr=&id=6lmfDAAAQBAJ&oi=fnd&pg=PP1&dq=cloud+security+VM+%22rollback%22+attack+virtual+machine+IaaS&ots=7T2WMVlIAd&sig=UjMEeMKQ3CxwcccU3v29Wi3Zp6w,"R Sturm, C Pollard, J Craig - 2017 - books.google.com","Application Performance Management (APM) in the Digital Enterprise: Managing Applications for cloud security VM ""rollback"" attack virtual machine IaaS , Mobile, IoT and EBusiness",2017.0
286,"… for vendor-neutral interoperable  services, and/or when making architectural decisions for  migration and … The European Network and Information  … previous studieshave focused more on interoperability and portability issues of  computing … ",3,http://eprints.bournemouth.ac.uk/29907/,J Opara-Martins - 2017 - eprints.bournemouth.ac.uk,"A decision framework to mitigate vendor lock-in risks in cloud security VM ""rollback"" attack virtual machine IaaS (SaaS category) migration.",2017.0
338,"… layer 106 includes special-purpose   referred to herein as  network functions …110 can include, in some embodiments, a set of common  services that … For example, aprotocol with suspend and resume or checkpoint and  capabilities includes … ",2,https://patents.google.com/patent/US9749242B2/en,"A Parikh, NR Atluri, P Bajpay, S Ganesan… - US Patent …, 2017 - Google Patents",Network platform as a service layer for open systems interconnection communication model layer 4 through layer 7 services,2017.0
48,"… A. Carpen-Amarie, C.Leordeanu, A. Costan, and G. Antoniu, ”Managing Data Access on :A Generic Framework for Enforcing  Policies”, In … and Applications (AINA), 2011 [6] R.Sravan Kumar and A. Saxena,”Data integrity proofs in  storage”, Third … ",2,https://ieeexplore.ieee.org/abstract/document/8058286/,"A Ochani,  - … IoT in Social, Mobile, Analytics and  …, 2017 - ieeexplore.ieee.org","issues in cloud security VM ""rollback"" attack virtual machine IaaS computing",2017.0
333,"… conferences/workshops (CSE, HPCC, ISPA, GPC, ScaleCom, ESCAPE, GPU-, FutureTech,GPUTA … Bruce Schneier, an internationally renowned  technologist, refers to this as the …Available at: https://.edps.europa.eu/EDPSWEB/ webdav/site/mySite/shared … ",16,https://content.taylorfrancis.com/books/download?dac=C2015-0-77928-6&isbn=9781498768085&format=googlePreviewPdf,", H Jiang,  - 2017 - content.taylorfrancis.com",Big data management and processing,2017.0
101,"… Here the data is stored as fragments in many  and the data can be reconstructed whenit …  issues related to authentication, authorization and accounting … a user, enforcing policies,confirmation on user's identity to connect, to access or use the  resources and … ",10,https://www.degruyter.com/downloadpdf/j/cait.2017.17.issue-4/cait-2017-0039/cait-2017-0039.xml,", , P Jelciana - Cybernetics and Information …, 2017 - degruyter.com","Exploring cloud security VM ""rollback"" attack virtual machine IaaS issues and solutions in cloud security VM ""rollback"" attack virtual machine IaaS computing services–a survey",2017.0
329,"… Mahdi Fahmideh, Farhad Daneshgar, Fethi Rabhi, “ Computing Migration: An EffectiveTailoring Approach”, Twenty-Seventh Australian Conference on Information Systems-ACIS 2016(ACIS). Page 8. VIII …  Infrastructure a as Service IP Internet Protocol … ",1,https://www.researchgate.net/profile/Mahdi_Fahmideh/publication/322569043_A_Methodological_Approach_to_Support_Cloud_Computing_Migration/links/5a602707458515b4377ba1e7/A-Methodological-Approach-to-Support-Cloud-Computing-Migration.pdf,MF Gholami - 2017 - researchgate.net,"A Methodological approach to support cloud security VM ""rollback"" attack virtual machine IaaS computing migration.",2017.0
28,"… have been mentioned as barriers [6]. Therefore, where there are apparent benefits of public ,there also … and Application Programming are most important issues that need to be addressedbefore going on the  … The CSP2 must update the  policy promptly … ",17,https://ieeexplore.ieee.org/abstract/document/7905258/," - 2017 2nd International Conference on Anti-Cyber …, 2017 - ieeexplore.ieee.org","computing: Technology, cloud security VM ""rollback"" attack virtual machine IaaS issues and solutions",2017.0
27,"… Conse⁃ quently, the remaining data can be found and utilized by at⁃ tackers. In elastic ,the data eras⁃ ing usually occurs in the resource reallo⁃ cation process … The  of and hypervisors directly determine the securi⁃ ty of the whole  platform … ",2,http://zte-deutschland.de/pub/endata/magazine/ztecommunications/2017/2/articles/201706/P020170613314208461859.pdf,"C Wu, Q Liu, Y Li, Q Cheng, H Zhou - ZTE Communications, 2017 - zte-deutschland.de",A survey on ,2017.0
168,"… It turns out that the applications running on computer  are very diverse … The broad spectrumof  applications adds to the challenges faced by  infrastructure … to increase efficiencyand lowering the response time, while supporting performance and  isola- tion … ",371,https://books.google.nl/books?hl=nl&lr=&id=O9smDwAAQBAJ&oi=fnd&pg=PP1&dq=cloud+security+VM+%22rollback%22+attack+virtual+machine+IaaS&ots=NOnYPxv0zQ&sig=SHdpCTUOWs1dSAfjwmWuLrAO2SE, - 2017 - books.google.com,computing: theory and practice,2017.0
32,"… The hybrid  is a composition of both public and private  characteristics … One of thevirtualization  challenges faces  system is a lack of  protection … Common that might threaten  infrastructure are Theft-of-Service, DoS, Malware Injection … ",15,https://www.tojdel.net/journals/tojdel/articles/v05i04/v05i04-01.pdf," - The Online Journal of Distance Education and e …, 2017 - tojdel.net","A Systematic Review Of cloud security VM ""rollback"" attack virtual machine IaaS Challenges In Higher Education",2017.0
203,"… and Mahanti,NC, A Novel Data Mining Algorithm for Semantic Web based Data ,International Journal of Computer Science and  (IJCSS), Vol … 2] Grossman Robert andYunhong Gu, Data Mining Using High Performance Data : Experimental Studies … ",1,https://pdfs.semanticscholar.org/25d7/3f65ca6bff4806d3ccf54e6bce940bb3db4b.pdf,"S Mohapatra, S Mohanty, A Hota… - … Journal of Computer …, 2017 - pdfs.semanticscholar.org","Performance evaluation of virtualization in a private cloud security VM ""rollback"" attack virtual machine IaaS test bed",2017.0
65,… Uses 0.1 user  for user authentication … 6. ISSUES IN  COMPUTING Computing can be defined as a pool of virtualised computing resources that allows users to gainaccess to applications and data in a web …  computing still have some issues [14] … ,3,https://pdfs.semanticscholar.org/b9f3/3e246a75eb0561b3acac7d0806068238e523.pdf,"S Mohapatra, S Mohanty… - … Journal of Computer …, 2017 - pdfs.semanticscholar.org","Comparison of various platforms in cloud security VM ""rollback"" attack virtual machine IaaS computing",2017.0
219,"… may be detailed if necessary, but these parameters are commonly used by  ServiceProviders … describes a framework to enable the collabo- ration among SSF instances from and cloudlets … A domain that is not under  has its  orchestrator in an idle state … ",8,https://ieeexplore.ieee.org/abstract/document/7980041/,"D Migault, , … - 2017 IEEE 37th …, 2017 - ieeexplore.ieee.org","A framework for enabling cloud security VM ""rollback"" attack virtual machine IaaS services collaboration across multiple domains",2017.0
75,"… The hybrid  is a composition of both public and private  characteristics … One of thevirtualization  challenges faces  system is a lack of  protection … Common that might threaten  infrastructure are Theft-of-Service, DoS, Malware Injection … ",13,https://www.researchgate.net/profile/Khalil_Al-Shqeerat/publication/315111319_Cloud_Computing_Security_Challenges_in_Higher_Educational_Institutions_-A_Survey/links/58ca98e2aca272a5508ab1bc/Cloud-Computing-Security-Challenges-in-Higher-Educational-Institutions-A-Survey.pdf,", MAF Al-Shrouf… - … Journal of Computer …, 2017 - researchgate.net","computing cloud security VM ""rollback"" attack virtual machine IaaS challenges in higher educational institutions-A survey",2017.0
144,"… computing, describes different services, deployment models present in the . Section 3 … allresources or services in a grid environment.  services are deployed to ensure  …provides various factions depending on the types of  services supplied … ",2,https://scholarworks.wmich.edu/masters_theses/919/,R Krishnan - 2017 - scholarworks.wmich.edu,"and Privacy in cloud security VM ""rollback"" attack virtual machine IaaS Computing",2017.0
21,"… A  that is deployed and shared among a group of people for share common interest, suchas mission,  policy, application and services is known as community  … A hybrid is mixing of two or more  with same infrastructure and capabilities. 3.4 … ",150,https://www.sciencedirect.com/science/article/pii/S1084804516302983,",  - Journal of Network and Computer Applications, 2017 - Elsevier",issues and challenges: A survey,2017.0
110,… The technology allows multi-tenancy in  through isolation mechanism and enables each tenant to perform its own services …   Alliance (CSA  Guidance V3.0)has produced guidance for critical areas of focus in  computing and … ,2,https://link.springer.com/chapter/10.1007/978-3-319-64653-4_1,",  - Guide to in SDN and NFV, 2017 - Springer","of Software-Defined Infrastructures with SDN, NFV, and cloud security VM ""rollback"" attack virtual machine IaaS Computing Technologies",2017.0
