,abstract,citations,link,reference,title,year
251,"… world and it has a close connection with the Database , Web  and   …antivirus software and anti  are very important for  and robust  systemestablishment in a network or system; as modern antivirus is able to  following … ",Alle 2 versies,https://papers.ssrn.com/sol3/papers.cfm?abstract_id=3484110,"P Paul,  - … on Emerging Trends in Management, IT and …, 2019 - papers.ssrn.com","NETWORK cloud security ""SQL injection"" attack malware : THREAT & MANAGEMENT",2019.0
226,"… this study we have tried to find out top five defense strategies to  emerging technology …Issue 9, September-2013 Page nos.68 – 71 ISSN 2229- 5518, “Study of  Computing in …Volume 3, Issue 6, June-2012 “Study of Latest Emerging Trends on Cyber  and its … ",HTML-versie,http://d.researchbib.com/f/5nnJcwp21uYzAioF9jqJWfnJAuqTyioaZio2A0o2WypwVjZGxiIwqWZGNjAv5jMTL.pdf,"P Patil, YS Chaudhari - 2019 - d.researchbib.com",Study of Emerging Threats in Cyber-,2019.0
599,"… The target users are penetration testers who need  friendly environment with onlineanonymity and … Encryption of HTTP using TLS (Transport Layer ) or SSL ( Sockets …types of code injection  (The  Buddy):  , HTML (JavaScript) … ",Alle 3 versiesHTML-versie,https://www.jates.org/index.php/jatespath/article/view/139,",  - Journal of Applied Technical and Educational Sciences, 2019 - jates.org",Some ethical hacking possibilities in Kali Linux environment,2019.0
610,"… are relatively computationally less powerful to maintain strong defense systems as  serversdo … associated with vulnerability discoveries, researchers also sought ways to actively edge devices … Xiao et al.: Edge Computing : State of the Art and Challenges … ",3Alle 3 versies,https://ieeexplore.ieee.org/abstract/document/8741060/,", Y Jia, , , … - Proceedings of the …, 2019 - ieeexplore.ieee.org","Edge computing cloud security ""SQL injection"" attack malware : State of the art and challenges",2019.0
663,"… an attacker has physical access to the device, there is nothing more that can be done to it [14 … Architecture (ie, gateway-dependent, mobile-controlled, -based), which depends onthe selected solution …   can be classified based on their nature as follows … ",3Alle 2 versies,https://www.sciencedirect.com/science/article/pii/S2542660519302343,", , ,  - Internet of Things, 2019 - Elsevier","IoMT-SAF: Internet of medical things cloud security ""SQL injection"" attack malware assessment framework",2019.0
778,"… with cross-site scripting vulnerabilities; databases are subject to   ; operatingsystem … Shantanu Pa[14], focuses on thedevelopment of a more   environmentto detect …user data whichevidences the level of data  provided in   … ",HTML-versie,https://pdfs.semanticscholar.org/8dbd/6e1b3f876b127636693d7d2901566afab38d.pdf,"SS Tiwari, R Talmale - 2019 - pdfs.semanticscholar.org","A Review on User Behavior Profiling and Decoy Technology in cloud security ""SQL injection"" attack malware Computing",2019.0
776,"… Application  (for , smart homes, mobile systems, etc.); … CVE-2015-2883 PhilipsIn.Sight B120/37 has XSS, related to the Weaved  web service, as … “It is extremely commonthat firmware can be updated in the field to fix bugs and  vulnerabilities, but once … ",7,https://link.springer.com/article/10.1007/s10586-018-2823-6,", A Tolstoy - Cluster Computing, 2019 - Springer","Internet of Things: information cloud security ""SQL injection"" attack malware challenges and solutions",2019.0
770,… this system can work for little systems like private ; however on huge scale  it is … Itought to be seen that CSP must have the most recent system  improvement strategies …imperative issue is to utilize IPSEC/VPN strategies between the CSP and  clients at … ,1,https://www.igi-global.com/chapter/security-challenges-and-resolution-in-cloud-computing-and-cloud-of-things/229165,"M Rath - Applying Integration Techniques and Methods in …, 2019 - igi-global.com","Challenges and Resolution in cloud security ""SQL injection"" attack malware Computing and cloud security ""SQL injection"" attack malware of Things",2019.0
758,"… Rogue clients, Rogue devices F– development/delivery • Denial of Service G–design and … OWASP (Open Web Application  Project) has a very neat summa- k rizationof the … unencrypted fashion, and since data go out from home into the , most people … ",2,https://books.google.nl/books?hl=nl&lr=&id=v4B_DwAAQBAJ&oi=fnd&pg=PA223&dq=cloud+security+%22SQL+injection%22+attack+malware&ots=foxz072MDF&sig=AP98t6PJwpOcsSTlCXqHFoNvz5w,"M Moh, R Raju - Fog and Edge Computing: Principles and …, 2019 - books.google.com","Using Machine Learning for Protecting the cloud security ""SQL injection"" attack malware and Privacy of Internet of Things (IoT) Systems",2019.0
744,"… Cybersecurity (CySec) describes “the ability to  or defend the use of cyberspace fromcyber-” (Cooper et al., 2010) …  Software Design & Engineering (IAS) (3). DatabaseAdmin (CSec, CySec) (10) … (21).   (CySec) (23). Mobile  (CySec) … ",27,https://aisel.aisnet.org/jise/vol26/iss3/4/," - Journal of Information Systems Education, 2019 - aisel.aisnet.org",Using Bloom's and Webb's Taxonomies to Integrate Emerging Cybersecurity Topics into a Computic Curriculum,2019.0
741,"… against shifting, scaling, permutation, and size means that any change in the number of flowsof an  (size invariance … of missed  samples) and true positives for  categories(number of detected  samples) for  Web  (CWS) blocks … ",21,https://patents.google.com/patent/US10187412B2/en,"K Bartos,  - US Patent 10,187,412, 2019 - Google Patents","Robust representation of network traffic for detecting cloud security ""SQL injection"" attack malware variations",2019.0
732,"… This made users to take  very seriously to  privacy and essential data … recover froman  quickly. The  is a great resource to fight against DDoS  … Jovičić, B., & Simić,D. (2006). Common Web Application  Types and  Using ASP.NET … ",HTML-versie,"https://www.saintleo.edu/hubfs/Resource%20PDFs%20and%20DOCs/Academics/Center%20for%20Cybersecurity/Student%20Projects/2019/Anthony%20Garcia,%20Michael%20Lee,%20&%20Phillip%20Waitkevich%20Web%20Applications%20Security.pdf","A Garcia, M Lee, P Waitkevich - 2019 - saintleo.edu",COM-450-CA01 5 March 2019,2019.0
719,"… By operating the platform 105 as a centralized yet  resource for multiple entities … One methodfor implementing the needed  measures is via digital rights management (DRM) … Justas DRM is used to  conventional copyrighted material (eg, audio and video … ",20,https://patents.google.com/patent/US10275600B2/en,"CJ Wysopal, CJ Eng, MP Moynahan - US Patent App. 10/275,600, 2019 - Google Patents","Assessment and analysis of software cloud security ""SQL injection"" attack malware flaws",2019.0
715,"… This incident was caused by improperly secured servers in Amazon , but the impact of …application that contains or uses identity data, you have an obligation to  that data … Youneed to be able to demonstrate diligent adherence to - and privacy-related policies … ",1,https://link.springer.com/chapter/10.1007/978-1-4842-5095-2_19,", A Hingnikar - Solving Identity Management in Modern …, 2019 - Springer",Failures,2019.0
670,"… An NAC solution can  a network from such end devices and detect and rectify these … [6]S. Khadafi, BD Meilani and S. Arifin,"" Sistem keamanan open  computing menggunakanids … [7] F. Arsin, M. Yamin and L. Surimi,"" Implementasi  system menggunakan … ",Alle 2 versiesHTML-versie,https://www.researchgate.net/profile/Mohammad_Alshammari/publication/336266496_Design_and_Learning_Effectiveness_Evaluation_of_Gamification_in_e-Learning_Systems/links/5daee953a6fdccc99d92b461/Design-and-Learning-Effectiveness-Evaluation-of-Gamification-in-e-Learning-Systems.pdf#page=381,"AS Putra, N Surantha - Editorial Preface From the Desk of …, 2019 - researchgate.net",Internal Threat Defense using Network Access Control and Intrusion Prevention System,2019.0
374,"… In the yr of 2012, LinkedIn was being  through the hacker through the   … Solving the problem of hypervisor  is an vital step in imparting a  surroundings for agencies and buyers to utilize. REFERENCES … ",HTML-versie,http://www.academia.edu/download/60419490/IRJET-V6I367020190828-127937-1n8vv3p.pdf,KR Dinakar - 2019 - academia.edu,"A Survey on Virtualization and cloud security ""SQL injection"" attack malware on Virtual Machine Monitor (VMM)",2019.0
665,… B2 US10489581 B2 US 10489581B2 Authority US United States Prior art keywords cookiessample  cookie virtual … 239000008264  Substances 0 abstract claims description36; 238000004590 computer program Methods 0 abstract claims description 23; … ,3,https://patents.google.com/patent/US10489581B2/en,", W Xu, K Sanders - US Patent 10,489,581, 2019 - Google Patents","Cookies watermarking in cloud security ""SQL injection"" attack malware analysis",2019.0
695,2.,4,http://solarenergyengineering.asmedigitalcollection.asme.org/article.aspx?articleid=2716680,",  - Journal of Manufacturing …, 2019 - … .asmedigitalcollection.asme.org",Intrusion Detection System for Cyber-Manufacturing System,2019.0
662,… Cybercrime Protecting Against Investment Fraud Protecting Against Identity Theft  BrowserSettings … HIPAA Sarbanes-Oxley Payment Card Industry Data  Standards Summary TestYour … Introduction Basics of Assessing a System Patch Ports  Policies Probe … ,96,https://books.google.nl/books?hl=nl&lr=&id=erauDwAAQBAJ&oi=fnd&pg=PT34&dq=cloud+security+%22SQL+injection%22+attack+malware&ots=F17tuVkRvo&sig=k9c9z3GyT8wdBW3kOx_AY-LrLvM, - 2019 - books.google.com,"Computer cloud security ""SQL injection"" attack malware fundamentals",2019.0
203,"… key, doing so will help the receiver validates that the message comes from a legitim source, whichis known in  field as … There are four main types of  associated with  [20] … Thus, this section discusses various  that can arise in  virtualization … ",HTML-versie,http://www.jatit.org/volumes/Vol97No19/17Vol97No19.pdf,"LS ALSALEEM, SA ALQAHTANI, SF ALHARBI… - Journal of Theoretical …, 2019 - jatit.org","COMPUTING BASED cloud security ""SQL injection"" attack malware AND COUNTERMEASURES: A SURVEY",2019.0
629,"… However, their application to IoT  components has been limited up to now … Program Analysisof Commodity IoT Applications for  and Privacy: Challenges and Opportuni- ties … [DD77]DE Denning, PJ Denning. Certification of Programs for  Information Flow … ",Alle 9 versiesHTML-versie,https://journal.ub.tu-berlin.de/eceasst/article/view/1104,", AK Mandal, … - … Communications of the …, 2019 - journal.ub.tu-berlin.de",Cross-Programming Language Taint Analysis for the IoT Ecosystem,2019.0
636,… Organizations are able to control and  user authen- tication through  software provided …at- tacks or information exfiltration since the company is unfit to  assets it … A complete stagefor   and encryption also ought to convey powerful access controls … ,Alle 4 versies,https://onlinelibrary.wiley.com/doi/pdf/10.1002/9781119593171#page=99,",  - Designs for the , Iot, and …, 2019 - Wiley Online Library","Application Safety and Service Vulnerability in cloud security ""SQL injection"" attack malware Network",2019.0
208,… Current method of digital identity management is not good enough for hybrid .Shared-Technology Vulnerabilities • Development of shared components is not guaranteed …TYPES OF    Affected  Services Effects Solutions … ,Alle 2 versies,https://ieeexplore.ieee.org/abstract/document/8769497/,"L Alhenaki, A Alwatban, B Alamri… - … & Information  …, 2019 - ieeexplore.ieee.org","A Survey on the cloud security ""SQL injection"" attack malware of cloud security ""SQL injection"" attack malware Computing",2019.0
83,Detection of   . Download PDF … 5; 239000003795 chemical substance byapplication Substances 0 description 39; 239000008264  Substances 0 … H04L63/00—Network architectures or network communication protocols for network ; H04L63/14 … ,17,https://patents.google.com/patent/US10447730B2/en,"SV Gupta - US Patent 10,447,730, 2019 - Google Patents",Detection of ,2019.0
28,"… 11] Z. Chen, F. Han, J. Cao, X. Jiang, S. Chen, “ computing- based forensic analysis forcollaborative network  management system … K. Kourai, T. Azumi, and S. Chiba, “Aself-protection mechanism against stepping-stone  for IaaS ”, in Ubiquitous … ",3,https://ieeexplore.ieee.org/abstract/document/8776897/,", M Saran, R Kumar - … Conference on  …, 2019 - ieeexplore.ieee.org","A survey on cloud security ""SQL injection"" attack malware over sensor-",2019.0
658,"… Due to the exponential increase in  breaches, companies should  their IT … Theseteams proactively  the network from intruders by gathering necessary information and …concerned with estimating the likelihood and impact of a successful  breach with … ",2,https://www.sciencedirect.com/science/article/pii/S0167739X18312081,"T Yaqoob, A Arshad, , … - Future Generation …, 2019 - Elsevier","Framework for Calculating Return on cloud security ""SQL injection"" attack malware Investment (ROSI) for cloud security ""SQL injection"" attack malware -Oriented Organizations",2019.0
191,"… They presented vulnerabilities associated with these attributes and  models of how the … Whilefocusing on  objectives is useful in  analysis, such classification does not … Theirsurvey categorizes  according to the components in the  in which they … ",10,https://www.sciencedirect.com/science/article/pii/S1389128618308259,", , , , N Fetais… - Computer Networks, 2019 - Elsevier","Systematic identification of threats in the cloud security ""SQL injection"" attack malware : A Survey",2019.0
245,"… Signature wrapping : Based on the  system, this type of  uses the XML signatureto … The  smart home system is a challenging and complex task. Software : The mainsource of  vulnerabilities in any network system is considered to be software … ",1Alle 2 versiesIn cache,https://www.mdpi.com/2076-3417/9/13/2763,", J Costa, , ,  - Applied Sciences, 2019 - mdpi.com","VPNFilter cloud security ""SQL injection"" attack malware analysis on cyber threat in smart home Network",2019.0
369,"… in the detection of and response to  threats in multi-tenant  by introducing a … In anexample, there is another tenant, tenant 210, in the multi-tenant  270 … or a type of abnormalitytriggering a report from application  module 142 to  policy engine … ",Alle 2 versiesIn cache,https://patents.google.com/patent/US20190281080A1/en,"H Chen - US Patent App. 16/414,070, 2019 - Google Patents","Multi-tenant cloud security ""SQL injection"" attack malware threat detection",2019.0
723,"…  presents a major concern echoed by many organizations migrating to  computing[1 …  layer III (application layer), Confidentiality, MITM  [30], VM, Client Device, Router,VM …   [35], Client Device, VM, LS, VM - VR, VM – VR – LS, VM – Client Dev … ",3,https://www.sciencedirect.com/science/article/pii/S0167739X18308768,", H Chen, Z Wang - Future Generation Computer Systems, 2019 - Elsevier","Bayesian network based weighted APT cloud security ""SQL injection"" attack malware paths modeling in cloud security ""SQL injection"" attack malware computing",2019.0
376,"… In cyber  in networking conference 2018 (pp … In international conference on  computing,data science & engineering 2018 (pp … 17] Bukhari SN, Dar MA, Iqbal U. Reducing  surfacecorresponding to type 1 cross-site scripting  using  development life … ",Alle 2 versiesHTML-versie,https://pdfs.semanticscholar.org/c23c/f1a1d31c3f7b67af350082a4a15fba7e225e.pdf,"M Agrawal, K Patidar, R Kushwah, S Chouhan - 2019 - pdfs.semanticscholar.org","A blowfish-RC6 (BRC6) with sending identification bit (SIB) mechanism for data cloud security ""SQL injection"" attack malware in XSS",2019.0
137,"… IDS), such as snort and Web Application Firewalls (WAFs), are used to  against web … Wepropose a generic distributed web  detection system on edge devices of the  … that deeplearning provides new solutions for challenges in the field of cyber  … ",9Alle 2 versies,https://ieeexplore.ieee.org/abstract/document/8821336/,", C Luo, J Qiu, … - IEEE Transactions on …, 2019 - ieeexplore.ieee.org","A distributed deep learning system for Web cloud security ""SQL injection"" attack malware detection on edge devices",2019.0
256,"… the  risks must be controlled. Even the data residing inside the  isvulnerable to . Much vulnerability in  still exists and hackers continueto exploit these  holes. In this paper, we have examined … ",HTML-versie,http://files.aiscience.org/journal/article/pdf/70080109.pdf,"E Kolawole, , O Odejide… - American Journal of …, 2019 - files.aiscience.org","Issues, Threats and Possible Solutions in cloud security ""SQL injection"" attack malware Computing",2019.0
366,… 2016. A hybrid fuzzy multi- criteria decision model for  service selection and importancedegree of component services in service compositions … In IEEE Transactions on dependable and computing) … 2018.  threats to critical infrastructure: the human factor … ,Alle 2 versies,https://dl.acm.org/doi/abs/10.1145/3341325.3342032,"P Touseef, , , H Tauseef… - Proceedings of the 3rd …, 2019 - dl.acm.org","Analysis of Automated Web Application cloud security ""SQL injection"" attack malware Vulnerabilities Testing",2019.0
136,… 7) Data Privacy: It is the ability of an individual to  sensitive data about themselves …Regulatory Compliance a. CSP must be able to submit to external Audits and  certificationsto  customers b. CSP needs to frame unified regulatory compliance … ,Alle 3 versiesHTML-versie,https://www.jestr.org/downloads/Volume12Issue3/fulltext81232019.pdf,", S Doddi - Journal of Engineering Science & Technology …, 2019 - jestr.org","Achieving cloud security ""SQL injection"" attack malware Solutions through Machine and Non-Machine Learning Techniques: A Survey.",2019.0
530,"… IOT, and sophisticated electronic gadgets [5]. As the  data storage and  data retrieval …Though many  vendors come up with new software and technologies, there were not … Stillandroid forensics and  forensics [14] stand as a major challenge for forensic … ",2,https://link.springer.com/chapter/10.1007/978-981-13-1580-0_67,", J Norman - … Conference on Artificial Intelligence and Cognitive …, 2019 - Springer",An Analysis of Digital Forensics in Cyber ,2019.0
523,"… The persistent nature of the threat makes it difficult for the defender to  against it … IsecLab's analysis of Amazon's , Amazon Web Services (AWS), showed exactly this, byhighlighting the state of AWS insecurity with respect to  vulnerabilities and … ",24,https://link.springer.com/article/10.1007/s11227-016-1850-4,", , SY Moon, D Moon… - The Journal of …, 2019 - Springer","A comprehensive study on APT cloud security ""SQL injection"" attack malware and countermeasures for future networks and communications: challenges and solutions",2019.0
230,"… and it has been derived properly and in clear way, which gives proper view of  and challenges … For  of  systems, here there is a consideration of three major factors … provides storage service for data where user can store data for future purpose … ",HTML-versie,https://www.researchgate.net/profile/Foram_Suthar/publication/335807665_A_Survey_on_Cloud_Security_Issues/links/5dd95adf458515dc2f48c00a/A-Survey-on-Cloud-Security-Issues.pdf,", SVO Khanna, J Patel - 2019 - researchgate.net","A Survey on cloud security ""SQL injection"" attack malware Issues",2019.0
297,"…  Agency (ENISA) reported that Dropbox (a large -storage service) was by DDoS … . In general, this research is based on the information exchange between  …performance is the base for decisions regarding the trustworthiness of a  … ",1,https://www.academia.edu/download/59222973/05_Paper_31031920_IJCSIS_Camera_Ready_pp67-9020190512-80804-19u1ak0.pdf,"L Alhenaki, A Alwatban, B Alahmri… - … and Information  …, 2019 - academia.edu","IN cloud security ""SQL injection"" attack malware COMPUTING: A SURVEY",2019.0
506,"… When we use vendor software, regardless of whether it is -based or on-premises, we open …The easiest and most effective way to  against   is to be proactive and write …Once those sensitive areas are located, address them with multiple levels of  … ",2,https://link.springer.com/chapter/10.1007/978-1-4842-4318-3_2,"E Pollack - Dynamic SQL, 2019 - Springer",Protecting Against ,2019.0
299,"… rapidly shifting towards  which raises new challenges for  and   solutionsare … Learning(ML) can be used to automatically monitor, discover, classify and  sensitiveinformation … used to find vulnerabilities that may be difficult for the  team to … ",Alle 2 versiesHTML-versie,http://asianssr.org/index.php/ajct/article/view/866,"A Dhondse,  - Asian Journal For Convergence In Technology …, 2019 - asianssr.org",Redefining Cybersecurity with AI and Machine Learning,2019.0
480,"… In cyber  in networking conference 2018 (pp … In international conference on  computing,data science & engineering 2018 (pp … 17] Bukhari SN, Dar MA, Iqbal U. Reducing  surfacecorresponding to type 1 cross-site scripting  using  development life … ",Alle 2 versiesHTML-versie,https://pdfs.semanticscholar.org/eaaf/1420fa4024b5bfce9802016ca7fad5e355e6.pdf,"M Agrawal, K Patidar, R Kushwah, S Chouhan - 2019 - pdfs.semanticscholar.org",Computation analysis and review based on cross-site scripting ,2019.0
479,"… 2  Which are Federated 9.2 … in e-commerce Reasons for the federation of  Graphtheory in computer networks Grap theory in  The major … of the prime concerns for anyorganization, whether governmental or private sector; and for the sake of  and safety … ",12,https://books.google.nl/books?hl=nl&lr=&id=e6iODwAAQBAJ&oi=fnd&pg=PP2&dq=cloud+security+%22SQL+injection%22+attack+malware&ots=Z1bBxhlZvX&sig=Gqp9dPmw_KSqkiFA7aCq06Pz9qk,", R Kumar, , ,  - 2019 - books.google.com","Cyber cloud security ""SQL injection"" attack malware in Parallel and Distributed Computing: Concepts, Techniques, Applications and Case Studies",2019.0
264,… as a reference model and discusses about various hypothetical means to elevate the strength of … [67] have discussed about different strategies that could  IoT from … are also workbeing carried out towards resisting specific forms of  in  environment as … ,Alle 2 versiesHTML-versie,https://pdfs.semanticscholar.org/a510/d652b39b2e34b859f6e70e85cfd8624e6b5c.pdf,"MC Patil - International Journal of Electrical & Computer …, 2019 - pdfs.semanticscholar.org","Reviewing effectivity in cloud security ""SQL injection"" attack malware approaches towards strengthening internet architecture.",2019.0
546,"… Because of these benefits, these databases are getting popular for large-scale  and web …So, to  applications from the risk of NoSQL injection … Sqreen [13] provides several publiclyavailable tools for  monitoring and protection monitoring including sup- port for … ",Alle 3 versies,https://ieeexplore.ieee.org/abstract/document/8754304/,", , Z Ahmed, A Iqbal… - 2019 IEEE 43rd …, 2019 - ieeexplore.ieee.org",Automatic Detection of NoSQL Injection Using Supervised Learning,2019.0
227,"… V. REFERENCES [1] Dan Gonzales, Member, IEEE, Jeremy M. Kaplan, Evan Saltzman, ZevWinkelman, and Dulani Wood, -Trust—a  Assessment Model for Infrastructure asa Service(IaaS) , IEEE Transactions On  Computing, Vol. 5, No … ",Alle 2 versiesHTML-versie,http://gujaratresearchsociety.in/index.php/JGRS/article/view/307,"JN Varshapriya - Journal of the Gujarat Research …, 2019 - gujaratresearchsociety.in","Vulnerabilities, Threats, cloud security ""SQL injection"" attack malware in cloud security ""SQL injection"" attack malware Computing",2019.0
444,"… evaluated authentication techniques, including OTPs, according to three axes: usability,deployability, and  [67] … Many mechanisms exist for mitigating - . Inthis … , they do  against attackers who obtain keys by stealing devices (without 16 … ",1Alle 2 versiesHTML-versie,https://scholarcommons.usf.edu/etd/7766/, - 2019 - scholarcommons.usf.edu,"Authentication and cloud security ""SQL injection"" attack malware -cloud security ""SQL injection"" attack malware Prevention Techniques in Web Applications",2019.0
318,"… involve Reconnaissance, Scanning, Vulnerability Assessment, Web Application  () and  … use for, further learning and improve their  analysis skills …transactions, Ecommerce, SCADA systems, inventory managements and  computing etc … ",Alle 2 versies,https://dl.acm.org/doi/abs/10.1145/3349266.3351391,"UM Khokhar, B Tran - Proceedings of the 20th Annual SIG Conference …, 2019 - dl.acm.org",Fundamentals of Ethical Hacking and Penetration Testing,2019.0
404,"… IEEE, 2013, pp. 549–553. [15] MT Sandikkaya and AE Harmanci, "" Problems ofPlatform-as-a-Service (PaaS)  and Practical Solutions to … IEEE, 2012, pp. 463–468. [16]S. Soufiane and B. Halima, ""SaaS  :  and Proposed Solutions"", Trans … ",1Alle 4 versiesHTML-versie,http://www.doiserbia.nb.rs/Article.aspx?id=0353-36701903345S,"MD Stojanović, … - Facta universitatis …, 2019 - doiserbia.nb.rs","Scada systems in the cloud security ""SQL injection"" attack malware and fog environments: Migration scenarios and cloud security ""SQL injection"" attack malware issues",2019.0
