,abstract,citations,link,reference,title,year
25,"… Ponemon Institute (2011)  of  Computing Providers Study, Traverse City, MI:Ponemon Institute. Ristenpart, T., Tromer, E., Shacham, H. et al. (2009) “Hey You, Get Off My: Exploring Information Leakage in Third-party Compute ,” 16th ACM … ",2,https://link.springer.com/chapter/10.1057/9781137474162_10,", ,  - Cybercrime Risks and Responses, 2015 - Springer","Criminals in the cloud security ""SQL injection"" attack malware : Crime, cloud security ""SQL injection"" attack malware Threats, and Prevention Measures",2015.0
23,"… mail servers from email providers such as Yahoo and Lycos, enterprises like CenturyLink, andsmall  like SoftLayer … at- tackers to abuse  resources to launch outbound  thanto  the -hosted tenants … At the same time, new  mechanisms need to … ",21,https://dl.acm.org/citation.cfm?id=2815707,", , ,  - Proceedings of the 2015 Internet …, 2015 - dl.acm.org","The dark menace: Characterizing network-based cloud security ""SQL injection"" attack malware in the ",2015.0
171,…  involves the use of a wide range of data  controls to  databases (including …INTERNATIONAL JOURNAL OF ADVANCED RESEARCH IN DATAMINING AND COMPUTING ISSN 2321-8754 ONLINE ISSN 2321 …  THREATS TO DATABASE … ,8,http://www.ijarcsa.org/may_2015/IJARDMCC/120515d04.pdf,"AM Chandrashekhar, ST Ahmed, N Rahul - … in data mining and  …, 2015 - ijarcsa.org","Analysis of cloud security ""SQL injection"" attack malware Threats to Database Storage Systems",2015.0
363,… Threat models are a useful way to perceive and  against threats that could cause damagefor an organization … and reduce any known risk through the use of a  operations centerutilizing  services and a  service level … PURR - Public   … ,3,http://insurehub.org/sites/default/files/reports/PURR-Public%20Cloud%20Security-Final%20Report-Auger_Hilgers.pdf,"R Hilgers, G Auger - Report from http://insurehub. org/sites/default …, 2015 - insurehub.org","Public cloud security ""SQL injection"" attack malware Final Report",2015.0
394,"… expanded into new sources of threats, such as social networking,  computing, smart … highestlevel, basic cybersecurity activities involve five functions: Identify, , Detect, Respond … software() to reach the vulnerabilities and then to accomplish its   … ",6,https://www.sciencedirect.com/science/article/pii/B9780128008874000304,", ,  - … and Simulation of Computer Networks and …, 2015 - Elsevier",analysis of computer networks: Key concepts and methodologies,2015.0
384,"… These components embedded in the  architecture to provide   computing … Theuse of IDS in the virtual machine is proposed in [39] to  the  … measures for CASProposed Threats There are also some threats, stated by   Alliance, which … ",4,https://pdfs.semanticscholar.org/d765/432eaf890f1e9d3f9cf621cc08474e4e8a74.pdf,"VK Veeramachaneni - International Journal of …, 2015 - pdfs.semanticscholar.org","Issues and Countermeasures in cloud security ""SQL injection"" attack malware Computing Environment",2015.0
743,"… vulnerabilities) is implemented in [64], this mechanism is a practical solution using intrusiondetection system to   service models … This must facilitate the correction of vulnerabilities in access control level. 4.2.6 Manage control mechanism per  level … ",11,https://ieeexplore.ieee.org/abstract/document/7337012/,", , H Houmani… - … conference on  …, 2015 - ieeexplore.ieee.org",challenges in intrusion detection,2015.0
17,… One   example uses on a form that has username and password textboxes … Howto select a reliable and  service provider is important. The   Alliance's STARinitiative is a step in the right direction towards alleviating the concerns over  … ,2,https://link.springer.com/chapter/10.1007/978-3-319-27161-3_21,"H Yu, , X Yuan - … Conference on Algorithms and Architectures for …, 2015 - Springer","computing threats and provider cloud security ""SQL injection"" attack malware assessment",2015.0
679,"… in the IT  landscape and translates threats into concrete policies and safeguards that the enterprise …  information and event management … 08-14, 2016-06-30, AjeyaHindupur Simha, Automating Monitoring Of A Computing Resource In A -Based Data … ",19,https://patents.google.com/patent/US9069930B1/en,"CV Hart - US Patent 9,069,930, 2015 - Google Patents","information and event management system employing cloud security ""SQL injection"" attack malware business objects and workflows",2015.0
639,"… Private  have been perceived as a relatively impervious deployment model among models … 5.  computing  optimization using cuckoo search algorithm with Lévy flightsas … the background section, hackers have been able to use the  for  … ",30,https://www.sciencedirect.com/science/article/pii/S0167404814001333," - Computers & , 2015 - Elsevier","Vulnerabilities and mitigation techniques toning in the cloud security ""SQL injection"" attack malware : A cost and vulnerabilities coverage optimization approach using Cuckoo search algorithm with Lévy …",2015.0
750,"… Centralized timed analysis in a network  system … en) *, 2011-04-08, 2012-10-11, HelenBalinsky, Method and system for monitoring a  document. US20120257249A1 (en) *,2011-04-08, 2012-10-11, Sundaram Natarajan,  and html based fax and document … ",1,https://patents.google.com/patent/US9009841B2/en,"Y Amit, , R Saltzman - US Patent 9,009,841, 2015 - Google Patents",Testing web applications for file upload vulnerabilities,2015.0
627,"… of parts of the federation 8. Thus, protecting the federated  against cyber … information relevantfor integrating the specification of  requirements into ‐based systems … specificationlanguages that can be used for both functional and  specification, Raihan … ",23,https://onlinelibrary.wiley.com/doi/abs/10.1002/cpe.3402,", ,  - … and Computation: Practice …, 2015 - Wiley Online Library","Modeling cloud security ""SQL injection"" attack malware requirements for cloud security ""SQL injection"" attack malware ‐based system development",2015.0
36,… It has become a preferred  framework solution for building private and public  withina large number of companies as well as research communities [22] … Clients need to changenetwork topology in case of public  implementation to apply  features [30] … ,6,https://pdfs.semanticscholar.org/1342/98f28f9bfdc39cc6520214ba8b7f26bbe338.pdf,"SV Hatwar,  - International Journal of …, 2015 - pdfs.semanticscholar.org","computing cloud security ""SQL injection"" attack malware aspects, vulnerabilities and countermeasures",2015.0
616,… 5 Relationship between  related function with inter  function and different service providers in an … The inter- federation capability provides an alliance among severalCSPs ( Service Providers) in which mutually-trusted  join together … ,11,https://link.springer.com/article/10.1007/s11277-015-2729-z,", MMZE Mohammed - wireless personal communications, 2015 - Springer","Building Customer trust in cloud security ""SQL injection"" attack malware computing with an ICT-enabled global regulatory body",2015.0
157,"… Sensors which generate  events. 2 … class AdaBoost algorithm, unlike the traditionaltwo-class AdaBoost, can be implemented for detecting normal behavior and different behavior like denial of service,   injection, and   based on … ",1,https://link.springer.com/chapter/10.1007/978-81-322-2126-5_25,"MS Akshay, A Kakkar, K Jayasree, P Prudhvi… - Artificial Intelligence and …, 2015 - Springer","Analysis in cloud security ""SQL injection"" attack malware Environment",2015.0
378,"… feedback and personae allow the user to choose between multiple personae when interactingwith  … They monitor the kernel and key components of the  periodically … site scripting, Man in the Middle , DNS , sniffer ,  concerns with … ",1Alle 2 versiesHTML-versie,https://pdfs.semanticscholar.org/bc74/cd67878d10d79e9e2da1f55d84f509b32823.pdf,"MJE Jiju, E Arun - JAECE, 2015 - pdfs.semanticscholar.org","computing: characteristics, issues and possible cloud security ""SQL injection"" attack malware solutions—a review",2015.0
334,"… to vehicle, adjacent infrastructure, wireless communication, important messages, vehicular and infrastructure . Similarly, for tier-3  threats are identified as data and networkthreats. In our future work, we will analyse the possible  solutions that  … ",24,https://ieeexplore.ieee.org/abstract/document/7431476/,", , … - … on Utility and  …, 2015 - ieeexplore.ieee.org","Vehicular cloud security ""SQL injection"" attack malware networks: Architecture, applications and cloud security ""SQL injection"" attack malware issues",2015.0
682,"… A system and method that provides protection to computers from   by running … A authority element, which becomes part of the Operating System, helps in … by using methodsor , such as, Structured Query Language ()  , for example … ",18,https://patents.google.com/patent/US8973136B2/en,"SN Shilimkar - US Patent 8,973,136, 2015 - Google Patents",System and method for protecting computer systems from ,2015.0
605,"… The  data is  on1y if the  users are accessing the data with great care sincethere is a possibi1ity of c10ud users to outsource the information … [12] Issa M. Khalil, AbdallahKhreishah and Muhammad Azeem, "" Computing : A Survey … ",3,https://ieeexplore.ieee.org/abstract/document/7475303/,"T Brindha,  - 2015 International Conference on …, 2015 - ieeexplore.ieee.org","An analysis of data leakage and prevention techniques in cloud security ""SQL injection"" attack malware environment",2015.0
303,… detection and provides some recommendation for a new framework to  web applications …Web  detection is an information  branch with significant promises …  platformstherefore; the proposed framework should be considering the  based applications … ,3,https://ieeexplore.ieee.org/abstract/document/7293028/,"MA Wazzan,  - … on IT Convergence and  …, 2015 - ieeexplore.ieee.org","Towards Improving Web cloud security ""SQL injection"" attack malware Detection: Highlighting the Significant Factors",2015.0
42,"… Our research in this area has only scratched the surface, the relevant  service vendors … whensetting up Wi-Fi networks such as WPA2 • Disable or  remote access to … as they could havebeen tampered with • Research the vendor's device  measures • Modify … ",100,https://www.researchgate.net/profile/Hadeel_Saleh_Haj_Aliwi/post/What_are_the_best_papers_in_IoT_Security/attachment/59dda4b44cde260ad3cea425/AS:548138643853312@1507697844002/download/paper1.pdf,"MB Barcena, C Wueest - Response, Symantec, 2015 - researchgate.net",Insecurity in the Internet of Things,2015.0
572,"… Nowadays, by developing  computing, a great part of Internet user activity has moved on …There are simple solutions to  ourselves as clients, such as choosing a  … parentlocation attribute, determines modern browsers to consider this as a  breach due to … ",4,http://mss.academiaromana-is.ro/mem_sc_st_2015/3_Pirnau.pdf,"M PÎRNĂU - Memoirs of the Scientific Sections of the …, 2015 - mss.academiaromana-is.ro",General Aspects of Some Causes of Web Application Vulnerabilities,2015.0
5,"… 156–159. [13] V. Nirmala, R. Sivanandhan, and R. Lakshmi, “Data confidentiality and integrityverification using user authenticator scheme in ,” in Green High … 1–5. [14] V. Anne, J. Rao,and R. Kurra, “Enforcing the  within mobile devices using  and its … ",10,https://ieeexplore.ieee.org/abstract/document/7380697/,"R Patil Madhubala - … on Green Computing and Internet of …, 2015 - ieeexplore.ieee.org","Survey on cloud security ""SQL injection"" attack malware concerns in cloud security ""SQL injection"" attack malware computing",2015.0
768,… Page 14. APT Forensics 3  or Cross Site Scripting[17] … Although the  communitystill debates over whether it is being used for digital espionage we know … Typically the initial vectors from all the four APT  were using techniques such Spear … ,7,https://pdfs.semanticscholar.org/0590/c5e44476418dd138fbd495a1cd933f9877c4.pdf,"T Slot, F Kargl - 2015 - pdfs.semanticscholar.org","Detection of apt cloud security ""SQL injection"" attack malware through external and internal network traffic correlation",2015.0
138,"… [8] RA Popa, JR Lorch, D. Molnar, HJ Wang, and L. Zhuang, “Enabling  in  storageslas with … 242, 2011. [9] S. Ruj, M. Stojmenovic, and A. Nayak, “Decentralized access control withanonymous authentication of data stored in ,” Parallel and Distributed … ",49,https://derby.openrepository.com/handle/10545/620916,", SY Zhu - 2015 - derby.openrepository.com","A survey on top cloud security ""SQL injection"" attack malware threats in cloud security ""SQL injection"" attack malware computing",2015.0
486,"… Internet application technologies, such as  computing and  storage, have increasinglychanged … In order to  this information, network  technologies, such as databaseprotection … Most modern site  detecting tools only prompt that there are risks in … ",7,https://journals.plos.org/plosone/article?id=10.1371/journal.pone.0117180,"YC Cho,  - PloS one, 2015 - journals.plos.org",Design and implementation of website information disclosure assessment system,2015.0
579,"… The applications frequently are not  against network traffic; they may use SSL/TLS duringauthentication, but not elsewhere, exposing the data and session IDs to interception … “Mobile  Challeges and -Based Detection”, 2014 … ",19,https://pdfs.semanticscholar.org/c2e2/4c461ae72d4aa905924c12bb0d42c60aca8d.pdf,"Y Cifuentes, L Beltrán… - … Conference on Mobile …, 2015 - pdfs.semanticscholar.org","Analysis of cloud security ""SQL injection"" attack malware vulnerabilities for mobile health applications",2015.0
4,… It is essential to identify the possible   and threats for implement the better mechanisms to   computing environment … REFERENCES 1. Te-Shun Chou. threats on  computing vulnerabilities. International Journal of Computer … ,2,https://www.researchgate.net/profile/Neeta_Sharma7/publication/296561649_Web_Based_XSS_and_SQL_Attacks_on_Cloud_and_Mitigation/links/56d698e208aee1aa5f7389ea.pdf,", ,  - J. Comput. Sci. Eng. Softw. Test, 2015 - researchgate.net","Web based XSS and SQL cloud security ""SQL injection"" attack malware on cloud security ""SQL injection"" attack malware and mitigation",2015.0
64,"… 2010. [6] Bernsmed, et al., ―Thunder in the :  challenges andsolutions for Federated ‖, 4th IEEE International Conference on Computing Technology and Science Proceedings, 2012. [7 … ",6,https://www.researchgate.net/profile/Praveen_Challagidad2/publication/304012876_Security_Issues_and_Countermeasures_in_Cloud_Computing/links/5762db1d08ae192f513e3b65.pdf,", PS Challagidad, … - International Journal of …, 2015 - researchgate.net","Issues and Countermeasures in cloud security ""SQL injection"" attack malware Computing",2015.0
532,"… Available: http:// en.wikidpedia.org/wiki, [Oct, 20,2014].T. Ristenpart and e. al, ""Hey, you, get offof my : exploring information leakage in third-party compute ,"" presented at the16thACM conference on Computer and communications , Chicago, IL … ",7,https://pdfs.semanticscholar.org/1c48/d657a0ad2728aa5ce28d4f8ce2b08ccfe502.pdf,"LM Joshi, ,  - International Journal of …, 2015 - pdfs.semanticscholar.org","Understanding threats in hypervisor, its forensics mechanism and its research challenges",2015.0
504,"… Private, hybrid, or public  … Lack of  talent The 3rd Platform of IT (,Big Data/analytics, mobile, social) will change the demands on 95% of all IT skills,including , over the next three to five years … ",11,http://northshorechoral.com/millerjw/dom/gsb622online/week5/GSB%20622%20MIS%20IDC%20%20Big%20Data%20and%20Predictive%20Analytics%20%20On%20the%20Cybersecurity%20Front%20Line.pdf,"R Eastman, M Versace… - IDC Whitepaper, February, 2015 - northshorechoral.com",Big data and predictive analytics: on the cybersecurity front line,2015.0
604,"… Centralized timed analysis in a network  system … en), 2011-04-08, 2012-10-11, HelenBalinsky, Method and system for monitoring a  document. US20120257249A1 (en) *,2011-04-08, 2012-10-11, Sundaram Natarajan,  and html based fax and document … ",3,https://patents.google.com/patent/US8931102B2/en,"Y Amit, , R Saltzman - US Patent 8,931,102, 2015 - Google Patents",Testing web applications for file upload vulnerabilities,2015.0
555,… container and show its advantages when deploying portable and light-weight application instancesin a  cluster environment … Ⅱ. Background Cyber- is a top concern in nearly everymajor industry … dollars to build  environments for their services … ,1,https://etd.library.vanderbilt.edu/available/etd-03232015-010522/unrestricted/ETD.pdf,W Wang - 2015 - etd.library.vanderbilt.edu,"A cyber-cloud security ""SQL injection"" attack malware defense method using Docker containers",2015.0
451,"… c) Eliminate  : the present techniques will  the login page against  simply … US7383570B2 (en), 2008-06-03,  authentication systems and methods …US20110246196A1 (en), 2011-10-06, Integrated voice biometrics   gateway … ",8,https://patents.google.com/patent/US20150020178A1/en,"G Grunin, DE Nachman, … - US Patent App. 13 …, 2015 - Google Patents",Using Personalized URL for Advanced Login ,2015.0
153,"… are putting their private information on the internet, motivating research into  computing,database … characters to  against such as ""space"", ""parentheses"", ""SELECT"" or ""INSERT""to expand the … of websites were  to our attempts thanks to sound  practices … ",3,https://pdfs.semanticscholar.org/886c/69b72a6693f5774c5bb0d0e50fbdc5bcfac4.pdf,"YC Cho - Tehnicki vjesnik/Technical Gazette, 2015 - pdfs.semanticscholar.org","IMPLEMENTATION AND ANALYSIS OF WEBSITE cloud security ""SQL injection"" attack malware MINING SYSTEM, APPLIED TO UNIVERSITIES'ACADEMIC NETWORKS.",2015.0
541,"… news are long gone, a substantial need exists for a network  system that … a network, detectparticipation in active botnets, and employ other techniques to  a network … suspicious fileshosted thereon, wherein the hashes may communicated to a  database that … ",100,https://patents.google.com/patent/US9088606B2/en,"MJ Ranum, R Gula - US Patent 9,088,606, 2015 - Google Patents","System and method for strategic anti-cloud security ""SQL injection"" attack malware monitoring",2015.0
537,"… , a private  that can be extended to use resources in public ; and Commu … theintegrity and confidentiality of information from either malicious or vul- nerable  applications …to detect  that do not cause illegal information flow or violate  poli- cies … ",4,https://www.jstage.jst.go.jp/article/ipsjjip/23/4/23_392/_article/-char/ja/,"M Elsayed, M Zulkernine - Journal of Information Processing, 2015 - jstage.jst.go.jp",A Classification of Intrusion Detection Systems in the ,2015.0
611,"… It is crucial that proper steps are taken from the beginning to  the organization against and privacy breaches. 3.5 Big  Data … In   category, readers votedon Services and products designed to  business use of  computing, includ … ",5,https://link.springer.com/chapter/10.1007/978-3-319-11056-1_14,"X Zhang, S Xiang - Big Data in Complex Systems, 2015 - Springer","Data Quality, Analytics, and Privacy in Big Data",2015.0
735,"… This allows them to enforce  services in the enterprise and the  provider consistently.2.3. Cyber  in federated  … In the same way, a malicious CSP of the  Federationmay perform several  towards service instances running on it … ",11,http://researchonline.ljmu.ac.uk/id/eprint/6936/,"AM Mac Dermott, Q Shi… - Journal of Computer …, 2015 - researchonline.ljmu.ac.uk","Collaborative intrusion detection in federated cloud security ""SQL injection"" attack malware environments",2015.0
593,"… Thus, how to  confidential record in memory against software or even physical , isan important and … 2. Minimal TCB on mobile device: Our system should not depend on the of software stack on the … For example, a company can use its private  to do so … ",25,https://dl.acm.org/citation.cfm?id=2741977,", Y Liu, , M Ma, H Guan, B Zang… - Proceedings of the …, 2015 - dl.acm.org","TinMan: eliminating confidential mobile data exposure with cloud security ""SQL injection"" attack malware oriented offloading",2015.0
774,"… eg  boots or power-downs, version controls, system software checks,  updates or …Businesses rely more and more on the  to keep their applications … insecure redirect, errortriggering sensitive information leak, session hijacking,  misconfiguration, and … ",20,https://patents.google.com/patent/US9158922B2/en,"J Liu - US Patent 9,158,922, 2015 - Google Patents","Method, system, and computer-readable medium for automatically mitigating vulnerabilities in source code",2015.0
595,"… To keep the data confidential, it is proposed to spread the data over various  … approachwith the help of diversification and obfuscation techniques to  the  applications …mitigating these  has become an important goal in the field of information  … ",2,https://link.springer.com/chapter/10.1007/978-3-319-54380-2_8,", , … - … on Enterprise , 2015 - Springer","Obfuscation and diversification for securing cloud security ""SQL injection"" attack malware computing",2015.0
519,"… Brock and Goscinski [11] characterise  problems of , evaluate  of current environments, present current  countermeasures … Closure of  service 11 … 4 showsthe  requirement and mapping to threats according to CSA Control Matrix [19 … ",1,https://ieeexplore.ieee.org/abstract/document/7359411/,", ,  - … Congress on Internet  …, 2015 - ieeexplore.ieee.org","Analysing threats in cloud security ""SQL injection"" attack malware storage",2015.0
597,"… Brokering policies will try to satisfy the user requirements and ' global performance atthe same time [9]. Thereby,  Federation introduces … Collaborative  between CSPsin a  Federation can offer holistic  to those in this scheme …  Comput., pp … ",2,https://ieeexplore.ieee.org/abstract/document/7563619/,", Q Shi, K Kifayat - … International Conference on …, 2015 - ieeexplore.ieee.org","Detecting Intrusions in Federated cloud security ""SQL injection"" attack malware Environments Using cloud security ""SQL injection"" attack malware as a Service",2015.0
313,"… see the potential to get more return on their investment with  , since they … to webapplications , provided by OWASP (Open Web Application  Project) indicates …square metric was used to detect application layer  (eg   ) in [24] … ",14,https://academic.oup.com/jigpal/article-abstract/23/1/45/2893005,"M Choraś,  - Logic Journal of the IGPL, 2015 - academic.oup.com","Machine learning techniques applied to detect cyber cloud security ""SQL injection"" attack malware on web applications",2015.0
429,"… Robertson ([45], [46], [47] ) describes that it would be difficult to  from IDS … In  computingscenario QualysGaurd WAS acts as a software- as-a-service (SAAS) … Proceedings of the 39thAnnual IEEE International Carnahan Conference on  Technology, Spain … ",7,http://citeseerx.ist.psu.edu/viewdoc/download?doi=10.1.1.735.11&rep=rep1&type=pdf,"TS Mehta, S Jamwal - IJCSIT) International Journal of Computer Science …, 2015 - Citeseer",Model to prevent websites from xss vulnerabilities,2015.0
93,… invention: 1. Flexible mode of operation based on external   as a … Misconfiguration—Good  requires having a  configuration defined and deployedfor … Sensitive Data Exposure—Many web applications do not properly  sensitive data … ,10,https://patents.google.com/patent/US20150121532A1/en,"N Barel - US Patent App. 14/068,084, 2015 - Google Patents","Systems and methods for defending against cyber cloud security ""SQL injection"" attack malware at the software level",2015.0
267,"… In private , Customer can have direct control of the total infrastructure, so there is no concernwhether … [23] SG Yang, “ computing  issues and … Wang, K. Ren, N. Cao and W. Lou,“Toward  and dependable storage services in  computing”, Services … ",6,https://www.researchgate.net/profile/Alo_Sen2/publication/287156799_Study_on_Cloud_Security_Risk_and_Remedy/links/5a950489a6fdccecff076351/Study-on-Cloud-Security-Risk-and-Remedy.pdf,"A Aich,  - Int. J. Grid Distrib. Comput, 2015 - researchgate.net","Study on cloud security ""SQL injection"" attack malware risk and remedy",2015.0
751,"… Editors Sushil Jajodia Center for  Information Systems Fairfax, VA Chandan … K. GhoshDARAC: DDoS Mitigation Using DDoS Aware Resource Allocation in  … InformationFlow Control An Automatic Inference of Minimal  Types … ",In bibliotheek zoeken,https://books.google.nl/books?hl=nl&lr=&id=HjM3CwAAQBAJ&oi=fnd&pg=PP6&dq=cloud+security+%22SQL+injection%22+attack+malware&ots=nZc7sGwCa_&sig=ISrJzLBE-lgPY7XjOUfPZcn8q48,", C Mazumdar - 2015 - books.google.com","Information Systems cloud security ""SQL injection"" attack malware : 11th International Conference, ICISS 2015, Kolkata, India, December 16-20, 2015. Proceedings",2015.0
