,abstract,citations,link,reference,title,year
212,"… Also, -based virtual lab platforms such as EDURange [14] and DETERlab [15 … 3. Cryptography3. Web  (including   and XSS ) 4. Network  4 … 7. Host hardening7. Firewall (including next-generation firewall) 8. Application  8. Intrusion … ",3,https://dl.acm.org/citation.cfm?id=3125687,", T Arney - Proceedings of the 18th Annual Conference on …, 2017 - dl.acm.org",Cybersecurity Should be Taught Top-Down and Case-Driven,2017.0
501,… 166 Hybrid  .....167 Common … 216 Browser Exploitation .....217 over the Internet with SET .....217  Scenario over … ,37,https://www.taylorfrancis.com/books/9781315145891,R Baloch - 2017 - taylorfrancis.com,Ethical hacking and penetration testing guide,2017.0
590,"… Computational Science/Intelligence and Applied Informatics/2nd Intl Conf on Big Data, Computing, Data … is not always the case as some service providers failed to  their customers …and be prepared for any potential online fraud and apply strong  practices to … ",Alle 3 versies,https://ieeexplore.ieee.org/abstract/document/8787038/," - … on Big Data, Computing, Data Science …, 2017 - ieeexplore.ieee.org",Risk Management in Online System,2017.0
569,"… life especially when people are starting to move their applications and personal data to the  …Because our model is designed to  a single web application in which the host name … In and Communication Networks (IWSCN), 2010 2nd International Workshop on … ",8,https://dl.acm.org/citation.cfm?id=3171594,"J Liang, W Zhao, W Ye - Proceedings of the 2017 VI International …, 2017 - dl.acm.org","Anomaly-based web cloud security ""SQL injection"" attack malware detection: a deep learning approach",2017.0
324,"…  user's data or application portability and inter communication across multiple [64, 65]. 3.3.3.3  and Privacy … Network  Enterprises store sensitivedata in the  server and SaaS vendor can manipulate it … ",HTML-versie,http://ir.inflibnet.ac.in:8080/jspui/bitstream/10603/249004/7/ch%202.pdf, - 2017 - ir.inflibnet.ac.in,"Developing A Framework For Strengthening cloud security ""SQL injection"" attack malware Resource Availability In cloud security ""SQL injection"" attack malware Environment",2017.0
273,"… With IaaS  offerings and private , and at the backend of PaaS and SaaS providers as well … implementation of  mechanisms and … Mean-time of incident discovery;Mean-time of incident recovery; Recovery time of failed tasks;  failure rate; FRC and … ",26,https://www.sciencedirect.com/science/article/pii/S2214212616300795,", M Bellaiche - Journal of Information and Applications, 2017 - Elsevier","Towards quantification and evaluation of cloud security ""SQL injection"" attack malware of cloud security ""SQL injection"" attack malware Service Providers",2017.0
275,"… It can be described as a -like platform having similar data, computation, storage andapplication … This wide range of functionality driven applications intensifies many  issuesregarding data, virtualization, segregation, network,  and monitoring … ",92,https://www.biomedcentral.com/openurl?doi=10.1186/s13677-017-0090-3,", ,  - Journal of Computing, 2017 - biomedcentral.com","Fog computing cloud security ""SQL injection"" attack malware : a review of current applications and cloud security ""SQL injection"" attack malware solutions",2017.0
694,… development is proposed in [5] and applied in [6] to a taxonomy for analytics on the  … General analytics software development requirements are … such as object-oriented and/orfunctional programming and distributed/local programming for /local computers … ,12,https://link.springer.com/chapter/10.1007/978-3-319-44257-0_8,"K Grahn, , G Pulkkis - Information fusion for cyber- …, 2017 - Springer","Analytics for network cloud security ""SQL injection"" attack malware : A survey and taxonomy",2017.0
279,"… In such a scenario, if unknown vulnerability is exploited in any one machine of ,with in no time it can bring down all other machines of the  … of positive and negative models is more appropriate to  our IT systems … ",Alle 2 versiesHTML-versie,http://www.academia.edu/download/55458605/IRJET-V4I1278.pdf,"M Swapna, GSS Kumar - 2017 - academia.edu","Contending cloud security ""SQL injection"" attack malware Threat using Hybrid cloud security ""SQL injection"" attack malware Model",2017.0
298,… It discovers all the hidden injection points in HTML5-based web applications deployed on theplatforms of  … Keeping the software up to date is also a form of good  … our proposedmodel and showed the first three common vulnerabilities effect and how to  them … ,1,https://www.researchgate.net/profile/Md_Badrul_Miah/publication/317365320_Enhancement_of_Web_Security_Against_External_Attack/links/5995774baca272ec908c5093/Enhancement-of-Web-Security-Against-External-Attack.pdf,"MF Haque, ,  - European Scientific Journal …, 2017 - researchgate.net","Enhancement of Web cloud security ""SQL injection"" attack malware Against External ",2017.0
94,"… use of TPM to realize a Dynamic Root of Trust Measurement able to  the BIOS … It is usedby leading  infrastructure as Amazon AWS, VMWare vCloud and OpenStack … Some hardwaretechniques shown in the previous part (ie, AES-NI) can influence  also at this … ",63,https://www.sciencedirect.com/science/article/pii/S0045790616300544,", , … - Computers & Electrical …, 2017 - Elsevier",: Emerging threats and current solutions,2017.0
21,"… Hybrid  are capable of crossing isolation and overcoming boundaries by the provider;therefore, it cannot … 4.6.2 Browser  Client uses browser to send the information on network …Injection  These  are known to be malicious act on the  computing in … ",2,http://www.academia.edu/download/53646702/F0706053138.pdf,"R Jathanna,  - International Journal of Engineering Research …, 2017 - academia.edu","Computing and cloud security ""SQL injection"" attack malware Issues",2017.0
24,"… can possibly be hacked by online cyber thieves, if they find a way to access the  … 175 millionusers and reported that their password database was compromised in a  breach for … ciousmodule is executed as one of the valid instances running in the ; then, the … ",3,https://www.researchgate.net/profile/Mdjulkar_Nayeen_Mahi/publication/320124329_Cloud_Computing_Security_Breaches_and_Threats_Analysis/links/59cef3c8aca2721f434f0493/Cloud-Computing-Security-Breaches-and-Threats-Analysis.pdf,", … - … Journal of Scientific & …, 2017 - researchgate.net","Computing cloud security ""SQL injection"" attack malware Breaches and Threats Analysis",2017.0
266,"… Hybrid : It is formed by combining two or more  described above … to exploiting thisvulnerability (API Vul- nerabilities, https://dome9.com/wiki/display//API+Vulnerabilities …Using Amazon Web Services for application deployment on the  is  as it … ",1,https://www.igi-global.com/chapter/a-survey/180063,", Y Gigras - … and Mitigating Robotic Cyber Risks, 2017 - igi-global.com",A Survey: Threats and Vulnerabilities in ,2017.0
358,"… This system basically concentrated on these log entries and suggested a preventive techniqueto  them from … IDSs including -based IDS solutions …    As it usestwo types of intrusion detection algorithms, it provides the double layer  to the … ",5,https://ieeexplore.ieee.org/abstract/document/8014614/,",  - 2017 4th International Conference on …, 2017 - ieeexplore.ieee.org","A survey on network cloud security ""SQL injection"" attack malware and Intrusion detection systems",2017.0
659,… International Journal of  Applications and Computing Volume 7 • Issue 3 • July-September2017 20 … Do﻿ some﻿ web﻿ browser-related﻿ -sensitive﻿ commands﻿ absent﻿ while﻿-sensitive﻿ information … to﻿decode﻿them﻿by﻿utilizing﻿their﻿private﻿credentials﻿in﻿a﻿﻿manner … ,33,https://www.igi-global.com/article/detection-avoidance-and-attack-pattern-mechanisms-in-modern-web-application-vulnerabilities/182251,",  - International Journal of Applications and …, 2017 - igi-global.com","Detection, avoidance, and cloud security ""SQL injection"" attack malware pattern mechanisms in modern web application vulnerabilities: present and future challenges",2017.0
367,"… of the hacker [2]. Server Side defense using Prepared Statement [9] is the most effective wayto  from SQL … [16] W. Rosenberry, Nexpose: Vulnerability Management and PenetrationTesting System v.5.1  Tar- get … [18] J. Singh, “Cyber- in  computing: A … ",9,http://ijns.femto.com.tw/contents/ijns-v19-n5/ijns-2017-v19-n5-p742-751.pdf,"UK Singh, C Joshi - IJ Network , 2017 - ijns.femto.com.tw","Information cloud security ""SQL injection"" attack malware Risk Management Framework for University Computing Environment.",2017.0
27,"… detect the faultless fluid data across local applications, across  and among  andit … 1 Opponents who may also be legal  clients may utilise the co-residence issue … 2 Many issues such as data breach, computation breach, flooding , etc., are incurred … ",21,https://www.researchgate.net/profile/Praveen_Challagidad2/publication/316345513_Cloud_computing_review_concepts_technology_challenges_and_security/links/5b25f49caca272277fb589b7/Cloud-computing-review-concepts-technology-challenges-and-security.pdf,", PS Challagidad, … - … Journal of  …, 2017 - researchgate.net","computing review: concepts, technology, challenges and ",2017.0
371,… Illustrates how DCSS can  against web page phishing  that are used to substitute …and de-shredding and re-assembly order verification to validate the  servers … case in userand application identity management to enhance passwords and  tokens used … ,6,https://patents.google.com/patent/US20170046530A1/en,"S Raj - US Patent App. 14/827,294, 2017 - Google Patents","Distributed cloud security ""SQL injection"" attack malware Storage System (DCSS) for cloud security ""SQL injection"" attack malware , reliable storage and retrieval of data and computing objects",2017.0
79,"… Additionally, the authors provide an overview of the previous research in the field of computing  … [13] present a wide overview and classification of 306 scientific publicationsaddressing vulnerabilities, threats,  in  and corresponding … ",9,https://www.biomedcentral.com/openurl?doi=10.1186/s13677-017-0098-8,", … - Journal of  …, 2017 - biomedcentral.com","Classifying cloud security ""SQL injection"" attack malware in IaaS cloud security ""SQL injection"" attack malware environments",2017.0
654,"… timely, consistent and complete information has integrity which is difficult for computer to  …3. A. Gupta and S. Shakya, “Information System Audit;  Computing  and … AM, “TheTechnology Acceptance Model and the Decision to Invest in Information ” … ",2,https://www.nepjol.info/index.php/JACEM/article/view/18966,",  - Journal of Advanced College of Engineering and …, 2017 - nepjol.info","Concerns on Information System and cloud security ""SQL injection"" attack malware Audit",2017.0
20,"… study of the rules generated and comparison with existing rules from community would enhance and reduce … It has also been observed that when similar types of  such XSS,  and  injection are tested in the  environment as a … ",3,https://ieeexplore.ieee.org/abstract/document/8229911/,"V Mahajan,  - 2017 International Conference on …, 2017 - ieeexplore.ieee.org",Integration of network intrusion detection systems and honeypot networks for ,2017.0
207,"… questions is to define whether to use local applications or a  environment for …www.openstack.org/) as an open source technology to enable private and public  … Somepeople specialize in organizational  aspects, which are less technical, some specialize … ",4,https://ieeexplore.ieee.org/abstract/document/8328365/,"M Frank, , T Pahi - … and Computing, 15th Intl …, 2017 - ieeexplore.ieee.org","Design Considerations for Cyber cloud security ""SQL injection"" attack malware Testbeds: A Case Study on a Cyber cloud security ""SQL injection"" attack malware Testbed for Education",2017.0
704,"… made unavailable through DoS , or a false data can be injected through    …diverse industries the service of , eg, for internet , data  and  .The challenge of  CPS has to be partly addressed by similar - As … ",18,https://dl.acm.org/citation.cfm?id=3130641,", ,  - Proceedings of the …, 2017 - dl.acm.org","cyber-physical systems: current trends, tools and open research problems",2017.0
215,"… [18] T. Ristanpart, E. Tromer, H. Sacham, and S. Savage, “Hey, you, get off of my : Exploringinformation leakage in third-party compute ,” In 16th ACM … [27] PP Ramgonda, and RRMudholkar, “ market cogitation and … [29] A. Ahmad, “Type of  threats and … ",Alle 2 versiesHTML-versie,https://www.academia.edu/download/60778829/120191002-36033-t28ynj.pdf," - Journal of Network and Information Volume, 2017 - academia.edu","Assessment of cloud security ""SQL injection"" attack malware Computing cloud security ""SQL injection"" attack malware Risks for E-Governance Infrastructure",2017.0
706,"… Antivirus cannot  spyware since upon authorization to download a program; the user allows …applications and services, provide evidence to customers that their organization are  andthey … 2. BR Kandukuri, VR Paturi, and A. Rakshit, “  issues,” in Proc … ",2,https://pdfs.semanticscholar.org/0ad2/ea53d4cb873ecdf99132fddb643429d43895.pdf,", L Tao, ,  - Application and Theory …, 2017 - pdfs.semanticscholar.org","Computing and its cloud security ""SQL injection"" attack malware Issues",2017.0
563,"… In addition, it cannot  against insider threats originating from a private network as it sniffs …Another widely used  solution is an Intrusion detection/prevention system (IDS/IPS … rules in its signature database which is used to detect known intrusions in the  … ",33,https://link.springer.com/article/10.1007/s11227-016-1805-9,", K Acha - the Journal of Supercomputing, 2017 - Springer","Virtualization layer cloud security ""SQL injection"" attack malware challenges and intrusion detection/prevention systems in cloud security ""SQL injection"" attack malware computing: a comprehensive review",2017.0
556,"… we have to establish trust across all these individual elements and  them from … blacklistedsignatures detect known  targeting the services on the  facing services … Analyzingmultiple data  layers, protocol violations,  signatures, this engine is started … ",2,http://www.arpnjournals.org/jeas/research_papers/rp_2017/jeas_0617_6146.pdf,"P Krishnan, J Najeem - … Conference on Operating System  …, 2017 - arpnjournals.org",A multi plane network monitoring and defense framework for sdn operational ,2017.0
591,"…  Backend (Database) Web server Brower HTML & CSS Data Server Side Static &Dynamic HTML & Scripts … Proper and adequate  measures should be in- place to organizational website, data and clients information from hackers … ",2,https://www.researchgate.net/profile/Isaac_Kofi_Nti/publication/317409760_Investigating_Websites_and_Web_Application_Vulnerabilities_Webmaster%27s_Perspective/links/595e5c69aca2728c114689b0/Investigating-Websites-and-Web-Application-Vulnerabilities-Webmasters-Perspective.pdf,"V Appiah, ,  - Int. J. Applied Inform …, 2017 - researchgate.net",Investigating Websites and Web Application Vulnerabilities: Webmaster's Perspective,2017.0
666,"… Also covered are the wireless networks—Bluetooth, Wi-Fi, and WiMAX—and measuresto increase their .  computing is examined, along with its advan- tagesand disadvantages … Chapter 4.  Information Systems … ",36,https://www.taylorfrancis.com/books/9781315116488,G Kostopoulos - 2017 - taylorfrancis.com,Cyberspace and cybersecurity,2017.0
32,"… Agency for Network and Information  (ENISA)  Framework for Government as a … keys, attackers use scripts that are used by attackers and  professionals alike …Organizations use APIs to connect to  services and applications, making them the … ",5,https://link.springer.com/chapter/10.1007/978-3-319-57186-7_58,"PN Borazjani - … Conference on Green, Pervasive, and  …, 2017 - Springer","Issues in cloud security ""SQL injection"" attack malware Computing",2017.0
648,"… For any organization, proper working of  arrangement is checked by VAPT. VAPT exploitsthe number of vulnerabilities such as   , cross site request forgery , CrossSite Scripting , input … 1. E-Commerce Application 2.  Application … ",4,https://ieeexplore.ieee.org/abstract/document/8463920/,", S Kurkure - 2017 International Conference on …, 2017 - ieeexplore.ieee.org",Vulnerability assessment and penetration testing of Web application,2017.0
649,"… The performance loss on a  infrastructure can be compared in a way to Netflix's approachto test the resiliency of their IT … MTD CBITS on the other hand, replaces instances proactively inan organized way for  purposes in virtualized environments (IaaS ) … ",8,https://link.springer.com/chapter/10.1007/978-3-319-66402-6_11,", , … - … in Computer , 2017 - Springer","MTD CBITS: Moving target defense for cloud security ""SQL injection"" attack malware -based IT systems",2017.0
507,"… Malicious users can use   and manipulate other customer's information … system inmanufacturing system with legacy equipment normally lacks in updated  measures, thusis … The  service resources can be Software as a Service (SaaS), Platform as a … ",14,https://www.sciencedirect.com/science/article/pii/S1877050917318549,",  - Procedia Computer Science, 2017 - Elsevier","Taxonomy of cross-domain cloud security ""SQL injection"" attack malware on cybermanufacturing system",2017.0
217,"… Sometimes users often face the problem of data storage over various  irrelevant to … Aspreviously mentioned,   issues can somewhat be controlled and prevented … V.CONCLUSIONS This paper systematically studies the issues present in the  architecture … ",1,http://repository.psau.edu.sa/jspui/retrieve/6e58637b-221b-4c07-a6ae-9a4065c3e14b/IJCTT-V47P105.pdf," - International Journal of Computer Trends and …, 2017 - repository.psau.edu.sa",Computing Data Breach,2017.0
105,… Community : A multi-tenant environment focused on a constrained set of organizations.These organizations meet up to share their computing resources and gain benefits … computing is vulnerable to several types of  threat …  Threats  on  … ,15,https://www.researchgate.net/profile/Hany_Atlam/publication/317299421_The_Impact_of_Cloud_Forensic_Readiness_on_Security/links/59317c9d0f7e9beee77a4189/The-Impact-of-Cloud-Forensic-Readiness-on-Security.pdf,", NHN Zulkipli, … - … Conference on  …, 2017 - researchgate.net","The impact of cloud security ""SQL injection"" attack malware forensic readiness on ",2017.0
714,"… so we need to combine both cryptographic primitives to achieve these  principles … proposed data sharing in  (SeDaSC) [60] methodology applicable in both conventional and …data owner, trusted third party known as cryptographic server on  (CS) and … ",16,https://link.springer.com/article/10.1007/s11227-016-1945-y,", AK Verma - The Journal of Supercomputing, 2017 - Springer","Data cloud security ""SQL injection"" attack malware in mobile cloud security ""SQL injection"" attack malware computing paradigm: a survey, taxonomy and open research issues",2017.0
239,"… 3. Access Control The Intrusion Detection System and firewall are used to  the  … needto make  assessment, management of  access, network scanning and storage .7. Filtering Schemes  filtering techniques is used to check the user input … ",1,http://journal.utem.edu.my/index.php/jtec/article/view/2759/0," - Journal of Telecommunication, Electronic and …, 2017 - journal.utem.edu.my","Data encryption scheme for large data scale in cloud security ""SQL injection"" attack malware computing",2017.0
240,"… SG cyber  guidelines in [28] highlighted the  services required to  the modern …The Fog gateway collects, processes, and stores meter data into the  … by utility companiesto monitor, share and coordinate the exchange of cyber  information, such … ",3,https://ieeexplore.ieee.org/abstract/document/8281911/,"RM Onoshakpor,  - 2017 IEEE 3rd International …, 2017 - ieeexplore.ieee.org","Cyber cloud security ""SQL injection"" attack malware in smart grid convolution networks (SGCNs)",2017.0
104,"… http://searchmidmarketsecurity.techtarget.com/definition/keylogger [6] Bhadauria, R., Al., A surveyon  issues in  computing. 2011 [7] RoderoMerino, L. et Am., Building safe Pass: A survey on  in the multitenant software platforms … ",1,https://www.researchgate.net/profile/Soufiane_Sail2/publication/320001842_SaaS_Cloud_Security_Attacks_and_Proposedsolutions/links/5b51f5f50f7e9b240ff1f39d/SaaS-Cloud-Security-Attacks-and-Proposedsolutions.pdf,"S Soufiane, B Halima - Transactions on Machine Learning and …, 2017 - researchgate.net","SaaS cloud security ""SQL injection"" attack malware : cloud security ""SQL injection"" attack malware and Proposedsolutions",2017.0
229,"… et al. "" Logical Isolation for Multi-tenancy in  storage."" Mass StorageSystems and Technologies (MSST), 2013 IEEE 29th Symposium on. IEEE, 2013.[12] http://php.net/manual/en/mongo..php 1. Notations … ",6,https://ieeexplore.ieee.org/abstract/document/7980323/,"B Hou, , K Qian, L Tao - … on big data on  …, 2017 - ieeexplore.ieee.org","Towards Analyzing MongoDB NoSQL cloud security ""SQL injection"" attack malware and Designing Injection Defense Solution",2017.0
254,… Captcha Breaking Spammers may break the Captcha Intruder may spam and over exhaust thenetwork resources A  speech and text encryption mechanism may prevent this  bybots … An integrated solution of the  threats in  is a possible scheme … ,1,http://search.ebscohost.com/login.aspx?direct=true&profile=ehost&scope=site&authtype=crawler&jrnl=09765697&AN=124871481&h=hps94%2FCEEV0A5yokJM0Tn%2FBV6nH7q11GO4lLbsrIvoqtBTRzvJNXCnacdLNXTKmef4%2Bt4VdUvB71Z%2F7WOewA7Q%3D%3D&crl=c,"V Pandey, M Dubey - International Journal of Advanced …, 2017 - search.ebscohost.com","IDS CRITERIA FOR ENHANCED cloud security ""SQL injection"" attack malware OVER cloud security ""SQL injection"" attack malware .",2017.0
108,… Private  are considered safer in comparison to public ; still they have multiple issues … on  data is increasing day by day with various techniques … site scripting carried outon websites accounted for roughly 84% of all  vulnerabilities documented … ,12,http://www.academia.edu/download/41895018/ajss-4-1-2.pdf,"SN Kumar,  - American Journal of Systems and Software, 2016 - academia.edu","A survey on cloud security ""SQL injection"" attack malware : cloud security ""SQL injection"" attack malware and privacy in cloud security ""SQL injection"" attack malware computing",2016.0
709,"… policy and assets, for which there is a business/personal driver to analyze and  … Client110 may be a server or  implementation configured to provide a main … eg, correspondingto configuration module 204) such as users and role,  campaigns configuration … ",48,https://patents.google.com/patent/US9473522B1/en,"I Kotler, I Livni, D Bar-Shalom, G Bejerano - US Patent 9,473,522, 2016 - Google Patents",System and method for securing a computer system against malicious actions by utilizing virtualized elements,2016.0
583,"… 2. Ismaili E, Houssam H , Houmani H, Madroumi H. A  Electronic Payment Protocol … Designa Resilient Network Infrastructure  Policy Framework … AR N. Authentication frameworkfor military applications employing wireless sensor networks and private  … ",1,https://pdfs.semanticscholar.org/5951/e4b6b16268dd885f1d447342076ec321986c.pdf,",  - Indian Journal of Science and …, 2016 - pdfs.semanticscholar.org","Framework to Mitigate Man-in-the-Middle cloud security ""SQL injection"" attack malware over SSL Protocol",2016.0
201,"… However there are more challenges in the case of IaaS public , as in IaaS the tenants canbe … indicates that “76 percent of respondents believe that the likelihood of malicious insiders inthe  is pos … Furthermore, if the  policy of tenants such as the tenant 1 in Fig … ",8,https://ieeexplore.ieee.org/abstract/document/7420656/,",  - IEEE Transactions on  …, 2016 - ieeexplore.ieee.org","On the design and implementation of an integrated cloud security ""SQL injection"" attack malware architecture for cloud security ""SQL injection"" attack malware with improved resilience",2016.0
190,"… For example, what are the different obfuscation techniques usually used to  software andhow effective and costly these approaches are … 293–306. [14] Hosseinzadeh, S., Hyrynsalmi,S., Conti, M., and Leppänen, V.  and pri- vacy in  computing via … ",5,https://dl.acm.org/citation.cfm?id=2983479,", , … - Proceedings of the 17th …, 2016 - dl.acm.org",A survey on aims and environments of diversification and obfuscation in software ,2016.0
701,"… controllers and actuators are being rolled out to realize intelligent monitoring, manufacturingand control [31], albeit often without  measures in place to  against eavesdropping …URL: http://www.trendmicro.com/-content/us/pdfs/ -intelligence/white … ",4,https://www.sciencedirect.com/science/article/pii/S2212827116307600,"E Ilie-Zudor, Z Kemény,  - Procedia CIRP, 2016 - Elsevier","Efficiency and cloud security ""SQL injection"" attack malware of process transparency in production networks—a view of expectations, obstacles and potentials",2016.0
